SatisfactionID,CustomerID,OrderID,DateID,SatisfactionScore,Comments,DateCreated,DateModified,RowHash
009aa2f5-4737-4f68-898e-20cff1cad415,2690,4933,20241126,7,Employee plan pass shoulder market century capital moment part.,2024-11-26,2024-11-26,889861ce8cf940d119a74076b54006ad
4540d73a-0a9e-4d96-a1b9-ac2072717c91,1491,3717,20250212,6,Bill he rate step page understand test myself own end.,2025-02-12,2025-02-12,e6c2dc24e197802786d53ee07a2ea17d
5e56359b-a1f9-4397-99a9-b1ccef1c97d3,525,4764,20240521,4,Notice point gun half own official a recently.,2024-05-21,2024-05-21,cf56d7d510a62e3b1d9ef8276b405252
efc2f4b4-a7c5-42e9-8db0-0d47d1808763,2058,3088,20241114,4,Black response whatever computer international marriage resource argue.,2024-11-14,2024-11-14,62c85d314dfcfb81a3deb96488548e31
a1a2f3ac-d0f5-4387-bb2b-281a26a8bc6a,4227,4939,20240818,1,Charge address just huge night mention.,2024-08-18,2024-08-18,af7b28833a5b6960cda54cd8b6d4477c
caf30457-e928-4934-bb9d-d22aeba755cb,909,1255,20240616,5,Reduce against Democrat leg board might road course range security.,2024-06-16,2024-06-16,5c24781af5b52f6cf11d452bc7c189cf
ca1c4daa-f6d2-46f1-9f87-415555f081d7,4326,2346,20250317,5,Travel end street eight tax.,2025-03-17,2025-03-17,f4bc28afc8f3029e059bbe142edf44c2
d8d3e4a1-8c4d-4a45-ace5-1fd4bce45d80,3921,4949,20250313,4,Different public pretty author however deep less.,2025-03-13,2025-03-13,83a75dcc7b0302e438f6d9f3d605436a
e100f483-76e7-4518-8f6f-08ff1890efef,3457,2863,20250204,7,Thousand board computer he buy reality.,2025-02-04,2025-02-04,3f503df5930e9083979af50cedbd5436
5f9cbbb3-ff2d-4478-8e2e-156f68058e91,974,573,20250309,6,Throughout cultural manage local today ball.,2025-03-09,2025-03-09,1cbf856635a6315038210a5de6093d52
952b73e7-c46e-4803-882b-f2767372c797,3356,4542,20240908,7,Source all task for yard fill pattern actually base because prevent.,2024-09-08,2024-09-08,0a31657aeca8c1e857870c0f3bd81470
89820ab8-a57a-4e48-adb8-393c20650704,1115,1084,20241118,4,Everybody easy positive real official street prevent which.,2024-11-18,2024-11-18,9c37c311ebff36ef21565f0a50b8a521
823a4223-5da7-4ebb-9673-e0ac26f2383f,509,3813,20241209,1,Choice office music affect paper kid.,2024-12-09,2024-12-09,a233027e7572ea91a3fdebe45ac36950
d72b747f-8546-44b0-a337-cff12cd87a46,3432,2747,20241124,10,Somebody draw should product little them consumer not under recent discussion.,2024-11-24,2024-11-24,48bd18ed03173d03df8a4c38088c92ca
4fed3a51-be5f-4e80-a15f-30d59af249f2,2068,4248,20240716,1,Race deep so animal paper west alone mother.,2024-07-16,2024-07-16,211cb304ea1110b83ce557f6115c098b
41ae9588-0d3e-4b15-b352-e9b41bf5f3cb,2590,1902,20241230,2,Eye surface hair until church.,2024-12-30,2024-12-30,3844f96a3de01202b4b27c597f36251d
58c5dfb5-70e6-455c-8e84-80dfeb2b501e,3103,288,20240728,3,Provide nature street seem start.,2024-07-28,2024-07-28,e27589907f86f8df9ca83a1c4c3d5084
0a599869-2460-4223-a63e-4580bad7df57,1070,3683,20241007,5,Town true change long hear everything consider.,2024-10-07,2024-10-07,2c4f48d5b9f713534b6df330ba9b231e
eaa7cd6f-d0bc-49d0-8cf9-553560f29f8e,1977,2033,20240831,1,Congress man third specific personal.,2024-08-31,2024-08-31,beeffbcc55e5c1e9040f6caa5326e16b
8c176e91-aad7-488c-a103-4159242ef257,1747,3605,20241216,3,Professional some whom position care name four partner.,2024-12-16,2024-12-16,1aac323c3eb7abba650ca89a679edd13
98702e1f-0756-4557-b1aa-95eea3e778a0,4031,553,20240716,9,Relationship however laugh threat three score sit measure mind.,2024-07-16,2024-07-16,591a43f3b9cca50fecf58bebafeb9b9e
8852572b-6109-4699-bfb4-3d0e4bc2c81e,3391,1327,20241214,5,System reality thought participant like cell member.,2024-12-14,2024-12-14,7b1561bb320e0328101af9645a318bd8
b3ed057c-258c-428e-8412-fcaa130df4df,2444,3741,20240822,6,Girl meet very expect day ask dream show.,2024-08-22,2024-08-22,203883d6f1887d9125a39de074c208b0
898097e1-ee67-49ab-b226-5bd7ec93fd9d,3428,1541,20240710,2,Because safe phone phone audience large argue finish game hear then.,2024-07-10,2024-07-10,1e063daa85c3e8bb10c66d1a40e2ea05
be118f1c-3575-419a-9ca5-1db173f7b1ab,862,1066,20250506,2,Wear then early no man.,2025-05-06,2025-05-06,0682891bd971dc1f37e66ee688c0dd53
008b900c-c4e7-4d2d-8c59-245cf3be1890,1718,4454,20240824,1,Establish bed cover lead few teacher go toward question.,2024-08-24,2024-08-24,7028c9f082e484f580f0c72d4db3211d
ac5f7361-f271-48aa-aebd-695be672a923,4027,4461,20240705,3,System yourself quickly save manage election.,2024-07-05,2024-07-05,66f99f37c8a8e8ba40a7d5d7d8457dc0
dc8f16cf-9210-402d-b38f-0f59d8e78dd7,4568,4000,20250325,9,Compare question surface send candidate alone economic.,2025-03-25,2025-03-25,5e5ffb9796293673115c64971eeb5fd3
50f0ad2c-6955-4bbb-a6f3-ee3fdff7ca4c,390,3237,20240530,7,Society left prevent large young executive push final black key.,2024-05-30,2024-05-30,d4066cc9b769b97e0c0dddc72ba348cb
d13bff0b-e32a-4a84-a790-2b0e6c780f55,636,2613,20241226,5,Carry art health blood evidence thought.,2024-12-26,2024-12-26,d1274c42739430e6f3451975b2280b3b
8fd8b42f-7102-4c61-a8af-528412856e50,2841,4184,20241011,6,Example suggest section else pattern itself.,2024-10-11,2024-10-11,dbefdffe355d12c599ccae0aa749940a
8e9ae935-97f3-407f-8239-f0737b5a64ac,4208,3288,20240623,7,Matter cost join learn personal example draw hold campaign.,2024-06-23,2024-06-23,e59f802dd69a7a2de22ba0676d3f69cd
1e606c53-fcb4-44b9-88ce-2f8e9f086955,1898,2898,20241029,7,Growth action deep six poor mouth.,2024-10-29,2024-10-29,f6f822af7891cc5a5e47e3f49ca40ec8
f401b44c-afbe-423f-a9f7-ad6b82eb38ac,2672,2429,20240927,2,Someone service how soon project set care election.,2024-09-27,2024-09-27,53090fcfc093e5f2968ef59821adebae
2625140c-6ae4-4db4-b260-f4323177bdb5,4284,236,20241216,3,Important drive different left method ready air some technology evening.,2024-12-16,2024-12-16,7f7f08ef7e2d28112c317e2113c4cb03
0950deee-0395-4419-807d-16f1e8bfbf14,4514,4279,20250507,3,Truth if lose wall cultural take rich some.,2025-05-07,2025-05-07,96d38e65132137815d8bd4429d5c1ca5
d05740f8-5406-4c83-b325-6a8d95a6a06a,2774,1143,20250211,2,Add itself land enough challenge attention.,2025-02-11,2025-02-11,c5b15fc9e935dbe9bfa7332dc53b49f9
cfe04252-c051-4113-ad07-679fe12bb259,1404,4287,20250506,9,Population form instead something record type majority many relate.,2025-05-06,2025-05-06,798c4d9a05859e632ea65086d8d19da1
c3834fdd-5392-4e03-ab94-7bea4162bf3f,3124,3546,20241212,10,Process six budget expert management.,2024-12-12,2024-12-12,d832793a02e64d4094816206998c6285
61fdf20c-46ec-417f-a265-e9cf58944298,340,2590,20241017,10,Truth long author create claim movement stay recognize.,2024-10-17,2024-10-17,0dc6d192ede7908d1932d146817687b1
7e511a1a-c9ad-437f-9bf8-4149254b5c0f,2233,3196,20250221,10,Fall national later hair street particularly help.,2025-02-21,2025-02-21,25279b8b895f7bb2825e9aec8387c307
52b8ca06-1e22-4d48-b6d8-52525bc2fc9e,4963,4309,20240809,5,Trial everybody civil help that.,2024-08-09,2024-08-09,69844eb64fd0c34a533930fdedcbf86d
e6f18d49-36cf-416f-b74e-e2c37e0191b0,1439,4398,20250305,9,Themselves arm far name serious throw.,2025-03-05,2025-03-05,c0c532fafcb59266023bc2aa5cc0b8d0
094fe1bd-c310-4428-a59a-dbebcf319615,1281,4364,20240512,5,Consider physical kind ready really forget.,2024-05-12,2024-05-12,77357c4afb8a212e83a5862c6bc260f6
25ed9b59-856f-4cc8-9200-c594e1f5e2d3,3679,295,20240926,6,Some most wall head indicate.,2024-09-26,2024-09-26,2691738f2554c941c3fe8ceae5cb8898
be4aaac3-ba7e-4ead-8dad-b52967914d19,1263,365,20250325,4,Situation product guess else old though.,2025-03-25,2025-03-25,e38b2ef6ba30ea299a43ff673c531bd7
e3dbee0f-d3ab-4cdf-a6f6-bea7c99a2289,650,1805,20240607,3,Senior think two Congress more decade admit value establish.,2024-06-07,2024-06-07,b4d020ae2a5ab04b390bdb746a15cfc3
787513bd-9002-45fa-8fb6-edc8d963dcba,4427,4551,20241007,8,Class central point station production chance open east reflect prevent.,2024-10-07,2024-10-07,f322524622d11c99c04879d9d5f46982
2bba6808-2607-458b-bfb2-6ddeb6f2e9b2,747,1373,20240803,4,Resource agency produce without smile meeting north chance civil property.,2024-08-03,2024-08-03,273d243f4b445007f83db336a476ddaa
08a6a0a8-9248-436d-9cfc-0764f9016a65,1306,138,20250511,4,Eat rate believe bank son.,2025-05-11,2025-05-11,fd2f6a1aef1de20a59e7531a72b4383d
b5fc9670-aafa-48bc-801f-6c6fbc534311,3544,3127,20240711,9,Worker thus expect assume herself store while into him.,2024-07-11,2024-07-11,db6b45dfee882c200f20353fdec52d11
7f684c2d-fbfd-4c47-863d-5fdde4f5e3ba,3576,2401,20250120,3,Look someone fund easy door poor vote.,2025-01-20,2025-01-20,6a7da8f6253c05395cfcaf9661897537
ea8c8a14-beb4-41eb-888b-b83f1baf2db7,3626,3937,20240717,9,Together value argue me since range particular knowledge.,2024-07-17,2024-07-17,a7eb63162f621cfe9d3d88df2b710b95
fbcbfc1e-adaf-40a2-a9e2-b2aa0127cd70,3189,1116,20240722,7,Light conference force rest.,2024-07-22,2024-07-22,0df0449accc57d6b8dfffd9390ef1118
baf056aa-8398-4743-bc9a-5816fe085022,4437,2769,20240815,3,Current morning action the wall affect cost before.,2024-08-15,2024-08-15,777b1bf3705e681d02c073ea9018a609
1be1886b-7ad5-42d2-8c08-f6496c920b2c,3861,1180,20250205,9,Area note stop point unit hospital clearly option indeed prove seven.,2025-02-05,2025-02-05,d5c9489cba75ca2abfbc0de7f92af680
01fbec0d-a023-405b-bfe0-ea0c486c3918,3791,3103,20250207,1,Budget safe draw doctor.,2025-02-07,2025-02-07,12ba7c5cce82333df8b6bd9e1da837cb
20545b5b-6b7a-4272-8db0-56b42b8f45e7,1993,1226,20240923,1,Manager the live include contain itself.,2024-09-23,2024-09-23,988028e63a422a45b479a36ab2bff08f
caa846b5-7e6e-4733-b69b-66b64ae43e7b,4144,3958,20250308,8,Yes now poor at different own stand push window full.,2025-03-08,2025-03-08,930382706a202b272cd6bf3771b04219
b7bcca09-5006-4c32-a60f-1ae5ddb7f73b,4597,1856,20250211,5,Visit seat fund decision herself budget hear.,2025-02-11,2025-02-11,7f7cf3049f056bd8017ea5133ab46559
142a44cc-2707-4d88-a2c5-3cc6166ab824,3586,656,20250413,1,Movement federal reflect another.,2025-04-13,2025-04-13,eb771fd529e5145073313f32f4bf1d52
f0d3599e-b408-401b-a5d4-640def517b7f,3332,1491,20241129,9,Figure go also indicate never property whatever.,2024-11-29,2024-11-29,d4e698252fe9c1d08e13cc417144a82e
4e70e147-a979-40f6-93b4-ce03af8b362a,1865,1818,20241210,5,Beyond political partner increase another become station paper.,2024-12-10,2024-12-10,a6c1646c8388cd209afbfe8ba4efd088
1ff20a14-8dcf-4118-bf09-49df3a9294a8,2843,3017,20241213,8,Close need its reality around gas your common notice might.,2024-12-13,2024-12-13,035b27f4e9ab372840bb4cca63ade9f4
8ad8c883-dba7-4160-80f1-617c2c914912,1989,2803,20250120,7,Science shoulder put human you including lose.,2025-01-20,2025-01-20,72a39bb903e6fb74919b97111160a3c4
427b9c38-8f46-48be-a8bd-a599213c0a24,1422,1581,20240828,3,Whether answer fly which matter popular court.,2024-08-28,2024-08-28,a690c674dc477b8092b84375d0a2fdf9
a1211dc3-f76a-4b92-908c-21d71fe0567f,3711,4094,20241018,1,Happy usually style memory question traditional effect cup section.,2024-10-18,2024-10-18,e1831548d607b94e21f6776952a5802f
e7b823f5-d1bc-4373-a9a2-714849bcf5f1,459,2087,20240827,6,Describe development black free ready series expert green score family.,2024-08-27,2024-08-27,b405ca247379f05fa2fb11da70ae8b80
207d9154-8915-4123-aaed-98b33580cfdb,1745,2783,20240812,9,Simple reflect design show everything.,2024-08-12,2024-08-12,d8191bf7c860577773a36b0e9830a3f2
86e132a0-60b7-45c9-b75c-5a416706daba,2921,4785,20240722,8,Call suddenly possible my mention.,2024-07-22,2024-07-22,20e2967833a7fc4619154cbe162db0b6
77902b63-8de3-4d4b-8a6e-5a2b9d3f38cd,1789,499,20250412,3,Trade although rate today send figure technology Mrs compare range before.,2025-04-12,2025-04-12,8768cacb313a8ce5345d36d97ec1b56b
95ca49a4-db89-4697-95f9-03ee9f1bcdfc,3788,1808,20250508,3,Cell two prepare office until stock.,2025-05-08,2025-05-08,c719d1a3457aa28cfc8e687e0c9edf55
4ca9c654-a71a-48b0-9f03-102d28a17afe,1395,4512,20250112,6,Guy reason loss pay however challenge music why measure.,2025-01-12,2025-01-12,b12aee81884fc51944c1c83a9695748b
8c8cf644-d368-43c8-9c96-2ac369927e83,3672,186,20240627,5,Until opportunity human go economy those machine yet.,2024-06-27,2024-06-27,535d31a7d856fae56e955aecce55ac70
27694030-9e67-4990-8482-ce0da93c02e3,1338,2086,20240711,1,Remain along church decision floor bar than not student.,2024-07-11,2024-07-11,6980a52c4c15b28c37be41553ac871fc
c776e81a-2483-491a-ad0e-afbe3768ea7d,1249,2713,20250223,6,Read director support least mean impact.,2025-02-23,2025-02-23,69ec3f4c3d602551db44147d981d2a29
09745bbc-29fe-43e6-be98-e5bc472d72fc,2767,2379,20250207,7,Plan here big kind because yourself democratic collection decide newspaper.,2025-02-07,2025-02-07,8673df89c7576fdfe9de067f8505a5a6
f13d7385-da3e-4991-974b-11d17c4d3f15,4270,4945,20240630,4,Worry relationship likely save stop base north production director.,2024-06-30,2024-06-30,438e7de93e3da472acbccc7714c71a41
e5025074-36f8-4e73-84b6-26b809b3ad14,4742,3686,20240609,8,Subject material manager heavy for blue occur already push fire factor.,2024-06-09,2024-06-09,4d8c5b9949e8e0f1dc77dad1fc86da35
824e36ce-167a-47c8-a7d7-d86ec24b0361,317,2402,20250123,2,Box citizen still everybody white entire.,2025-01-23,2025-01-23,68e5a431f419f0cabfee051dab9fb104
106ed327-9e32-409f-a3aa-5c76e1916ed1,852,3405,20240603,8,Civil because write marriage service modern before again particularly.,2024-06-03,2024-06-03,46e52bc385e7fd6d4a77a328fcb808d5
0daaa3fd-2710-4394-8f65-64ca62ca9c60,4571,4403,20240521,2,Three sign arm face practice individual artist hit near.,2024-05-21,2024-05-21,3b98ea6d03692639469f08b1c002fca4
10cbcedb-9460-4071-b1b9-4de0ad45ff1e,2947,4783,20250222,7,Save eat particularly in through thousand shake least.,2025-02-22,2025-02-22,c29310abbd488fcfd8dccee41c7680b5
48463ba6-1850-41a4-b9bc-1b6b124017dd,2339,3275,20240517,8,Billion range group media someone wrong design land my dream.,2024-05-17,2024-05-17,fe29d312fca99e64bcc2d89903d4e36e
385174ce-a64b-4cc1-a0be-0f2859eedbc0,1908,4323,20240928,7,Sit help data guy culture general.,2024-09-28,2024-09-28,55d7146653aa1cac2101aebcddaeec1e
b6917daf-6dc5-47c8-b4f3-d1e6fd703df8,2813,3114,20250401,10,My success officer skin quality keep decision southern.,2025-04-01,2025-04-01,e91c389cdf0a14721aa6e4500b4770ae
c675681e-2d6f-4e09-92a2-22449258cb17,84,2434,20241227,5,Avoid person season difference.,2024-12-27,2024-12-27,c8d0146c8bbb76b4b00ba2f243902419
c0300e9f-2842-42e8-aebe-49f436b1f475,4219,2168,20240905,7,Myself their anything director perhaps before future stand sister.,2024-09-05,2024-09-05,fcefc64611cbba9869998c4b06746f11
81b28cd6-9baa-4aa0-9d67-e146e834e603,4092,1870,20240601,4,Itself how question full no ask.,2024-06-01,2024-06-01,41914a63000b984a00d5507d48ff930c
76360ae2-eea0-458d-8f5a-ac5d3c32756c,1536,1461,20240813,10,Become another discuss table learn hope people.,2024-08-13,2024-08-13,c8aa3ba479b3ad20b34e21cca6d17958
5cb226a2-3352-41d1-b961-b9117c69121b,578,1336,20250412,5,Behavior south meet begin table produce.,2025-04-12,2025-04-12,0a493b039564838973fa025d519e8218
2d3e8854-22ad-4979-93a4-48f6693b1c7f,4460,4934,20241207,6,Which single spend movie once fight outside from.,2024-12-07,2024-12-07,0b54dc3d2b413342c4b8155d34d5d0dd
e818c712-ffad-4b83-9c66-912b44ca9c7d,2886,4380,20250417,8,Government sometimes shoulder operation person leave second.,2025-04-17,2025-04-17,3b6dcdfdb0ef9e8c88fc6a03c7ea71d5
47bd7e37-e473-4029-be06-56bbc8e9d9d7,3586,238,20241210,1,Art show ground end affect individual other together low.,2024-12-10,2024-12-10,ec98fb0bbfe1d387357bd11f3ee554db
b4e59ff7-7d40-4b48-81b8-d953443b81d0,3468,1325,20250321,4,Tax thought then happen program first senior service paper.,2025-03-21,2025-03-21,c783900dd7a84d2b6e24465693ed6e64
419a5dc5-4065-49bf-a2b6-f721cf633914,2145,2563,20240703,10,Threat notice age act start.,2024-07-03,2024-07-03,fea8fd31131c359c5bae958e7b5b9cf5
f59cd030-7c56-4214-b4c8-5da9a54ec432,4857,2286,20241001,3,Fact fact figure unit stuff growth head quite short past.,2024-10-01,2024-10-01,c0b55c413b0c07abad96852f6d8b0cbf
2655e357-f110-4cf6-a8d6-a7bb35a1f56a,3455,2250,20250424,1,Stock behind thus case wind.,2025-04-24,2025-04-24,fb4c93af44d3158019a242b0e706fceb
7ec4f18e-0be3-4253-ba6d-a54977e2177e,4000,3380,20240627,1,Prove always mouth buy to record.,2024-06-27,2024-06-27,ff7250e70ab05b25357ab07aacd203f9
40e55d50-e5b1-449f-870c-f573e18f9d68,4548,4872,20241116,6,Probably sport magazine another by poor this visit prepare.,2024-11-16,2024-11-16,07fdf0f9f4d77f29a66ed9d7a43d5ea3
693c8103-0ea4-4907-b2b5-e3569d4fcb0f,1691,485,20240826,2,Today machine turn dinner environmental.,2024-08-26,2024-08-26,1eb05027a9493dad4f2ac1d95f67c6e6
87b2cd1e-16fc-4713-8307-e73d0240c14c,1055,387,20250205,4,Risk reduce him choice no very since or well feel agree.,2025-02-05,2025-02-05,d1a7c3f4423dab26cb65d2b64b9840b7
226f401e-57a5-4377-8cc1-e84c02dd96b3,2007,4718,20241111,9,Much whole pull never hospital dog information finish professor.,2024-11-11,2024-11-11,d2f31a789555fecfa196f8ec1dc5d021
7dce74b4-b012-4de8-a894-d6ff73e255b2,238,962,20250107,4,Very establish perform safe interview born I morning.,2025-01-07,2025-01-07,cd021f6a9030808dfbc2b232da01b408
b98c50c4-452b-43bc-b3d0-bafe341d650a,4134,4087,20240518,2,Someone list seem summer produce central realize ball.,2024-05-18,2024-05-18,1ab700672cea138be4eb9de2b624976b
4963dc99-8dfa-4572-b6b0-c8e3307210db,3080,1178,20240804,9,Training would forward strong not clear.,2024-08-04,2024-08-04,e29ebe0923fd50d61cefc2b53edd7cd7
99bab8f9-618f-450b-bf60-d44a16ea7cf7,1834,2030,20250228,6,Later should government trip.,2025-02-28,2025-02-28,1146d96309beed3f0434afd49620b2a8
fb76d9f4-6bda-42a4-86f7-c053a463ad05,3476,4504,20250317,10,Real both include face investment edge most.,2025-03-17,2025-03-17,13ca0c270fa3e463c18a35575c03574c
468cfdc9-51fd-46d6-8106-58c513eb9c5d,437,2626,20250105,9,Vote system group down improve note trade risk fight drug clearly.,2025-01-05,2025-01-05,30b3372f86da475f1bf829be6fba600c
94ca2d60-0034-464d-8957-435ed752e4e4,621,313,20250328,9,Soldier anything attention lawyer often heavy from.,2025-03-28,2025-03-28,63f2c8a53949fb2792b4a2564765cd77
f5e84f74-f8ac-4401-9627-73b995b2b0a5,139,959,20250307,6,Let fast mission imagine only case meet.,2025-03-07,2025-03-07,a8082702794f185855a29ffae8e3730f
850dd81f-c9a3-43a4-be26-5cbe687431ed,1790,1694,20240812,8,Control themselves item suggest idea bad yard contain size piece.,2024-08-12,2024-08-12,7fde5d84a8a937fa363b48ec18f70141
de527463-582b-4161-b060-83b3b94429c7,2296,1620,20250430,6,Standard wall approach security you energy staff.,2025-04-30,2025-04-30,288da716cff867f56c1c401bcd42ecc3
2c0861ed-6573-426e-96ef-184edc8c8d3a,3308,3756,20250226,1,Song able say per guy bank travel ball camera benefit.,2025-02-26,2025-02-26,fad39c950598eb37f213fff08a78e921
ce983997-fe08-4f0e-a789-e20bd981ea86,1060,3686,20240801,8,Accept city me teach run.,2024-08-01,2024-08-01,27c175351991e34cf8549860af8cc187
45ebf4a3-aaff-4d75-804b-83b583e26243,1358,4191,20241007,8,Hit million reason real doctor think car left Mr democratic unit.,2024-10-07,2024-10-07,6cd06bc17ae479b74ee733137e8867d2
3c65c5b0-a85b-4805-bb2c-5d3baafe6077,581,2612,20241129,7,Common some born tree yet billion international page media late.,2024-11-29,2024-11-29,e86d8967c5b57a68cd17a9e2c4e5c393
d75227ab-d4c0-4ab0-b3bd-ac1d30a8f47a,2997,4982,20240522,7,Gun fill fact couple season more read.,2024-05-22,2024-05-22,1ff8ff86dd9264dd93c056a6c58d63f9
64387678-f4a8-49ed-a2a9-ea2896000f25,3016,3791,20250204,10,If yard management summer clear.,2025-02-04,2025-02-04,1d59f35d227681a38c34efac07a47ba1
a9ac7c5d-bbb1-474f-a8ee-870b5456234f,2424,2896,20241006,8,Hard forget bar so represent child same tell test space.,2024-10-06,2024-10-06,7e3bcb67ffc0393e79962b1f534fc12d
7600bd67-6d4b-4823-98f0-614e4c85e87a,2791,4656,20240925,6,According sometimes natural body personal body tell four young.,2024-09-25,2024-09-25,0f2f1c36c31321644f59ab74d522d346
c06f71e3-0640-4770-a5c1-4a765be4a64c,4670,3039,20250315,6,Store chance goal billion trial product face cultural.,2025-03-15,2025-03-15,f539560a212b9bfef9e77c135411c861
be1c403c-5c20-4c7c-8488-5ea2db71428b,209,2807,20241111,6,System score ahead region rule key accept.,2024-11-11,2024-11-11,2ad4f605c1685e4d174e29b73d40e7ec
fde34976-8ebf-4643-a702-747107f09e28,1967,3169,20240524,3,Party provide event threat far fund work because.,2024-05-24,2024-05-24,948b742a5cc6eb09bd8756d16362aa7d
4d82c57b-6db1-4189-8198-ad94d8d9df2f,4614,680,20241219,8,Notice movement know card as student.,2024-12-19,2024-12-19,16b199b3ffbd8e333b726985f024a5c6
5754ee05-0b46-4a7d-b815-fea41b5d89c0,940,2461,20250219,9,West else success traditional here change level spring hospital what.,2025-02-19,2025-02-19,b685b9372bbbd88678aba018d52931e8
a078c710-23d1-41a4-b3d6-024f3cecc886,2987,2345,20250215,2,Plan official step class.,2025-02-15,2025-02-15,4d8a60750172b37f2258a49ef843ffc3
bdc166bb-7a55-4168-b438-b07779f4b09c,4581,1838,20240907,10,Seek there special write small certain eight bed whatever raise meeting.,2024-09-07,2024-09-07,22f78beec40c9d72e63707c0c5f7b5fc
a4aa8262-37e6-4ad7-abc4-2472a54c47c0,2827,1315,20250405,6,Central future center home him clearly fill.,2025-04-05,2025-04-05,fe69ef6d86c0416cc926e54eddc19bb0
09734eb6-9f07-4023-bba0-e4fc47c9c224,1074,3007,20241202,3,Lay public maintain paper institution others site number decide any.,2024-12-02,2024-12-02,bfca526e50a31ffd8ef891e44f457181
867aa13a-9a8b-4185-9770-292b548fbc36,506,3713,20250315,9,Model run front scientist right just build though miss body.,2025-03-15,2025-03-15,b1e685c8e2a5fcd88acfb05c9d0ef2a1
de7d0750-506c-4c14-b44e-ba34a9999057,4102,1344,20240618,2,Factor trip reality commercial dinner for five safe memory why.,2024-06-18,2024-06-18,930da644c6981da5772f186919d3a281
6e0d33f3-9da4-4363-8298-15c2b37a2ef2,3231,2567,20241001,2,Edge brother all bit kind former trip.,2024-10-01,2024-10-01,564f736ae3fe2905097624867f17179f
5aa3706a-1e3d-4ac3-9448-79f0e039bb1d,550,5000,20250326,3,Plant cultural remember soldier itself toward security.,2025-03-26,2025-03-26,6eb4be45499c625d2c9760bc5c22a76e
6cfd0096-c0a0-4380-8515-5a7034621035,759,2453,20250404,6,Road certainly ten stuff material read property according.,2025-04-04,2025-04-04,7ea258011d2672a4359e79b6119efb15
72b49612-8f13-4c5e-b662-3f6a7cb7e3b7,4026,2420,20240729,5,Nothing watch put entire third second large character theory.,2024-07-29,2024-07-29,49ccb8bd5c0d99ab7d54338892b66dc7
0a2dbc72-acee-46bd-ba28-5904382bbaa6,2619,1221,20250125,1,Half able practice myself amount have have hand.,2025-01-25,2025-01-25,2b96c669b17304ebb6917154386fc4e1
0f98dfe8-07e3-4a46-a2d5-d03f97cc8632,1676,331,20240716,3,Hair I travel reflect cold agreement deep half.,2024-07-16,2024-07-16,9f9992bda648d33c45eb84870927535e
998898a9-4d8d-4326-8a44-4ea0c7adf05a,3880,3160,20240612,10,Benefit act rise play process class environment.,2024-06-12,2024-06-12,8f0e92dabb5b8e15b37c8bbfd3f2d7f6
bb680210-01ce-4f1d-b9e2-f4cd93b5a2c3,2147,3795,20241223,4,Should use draw say threat.,2024-12-23,2024-12-23,ab2e707122bd2612cb1c98e6e8d67573
2ec01299-ab28-4a42-9c9c-a961fe948299,211,4202,20250218,9,Son by hour position common cover old old check a former.,2025-02-18,2025-02-18,ee66e8541431d00f5407dc05a5b3255c
17c958f7-52e3-4aff-9612-2f962dbbb8cb,1160,2460,20250215,1,Player enough carry before against.,2025-02-15,2025-02-15,9b8acb4ad2e7bc8531d72c8a95671ff5
e31e3345-ec7d-482a-9c1a-754c4867ad78,1545,2969,20250414,4,Exist offer throughout reason require positive professor between ok head.,2025-04-14,2025-04-14,e3dee8e418067bfdeec680447336291a
e1dfb276-d384-4879-bb37-c9c3fec97505,1412,751,20250326,3,Or enter wait Republican policy trouble.,2025-03-26,2025-03-26,fc0d920689d5f56da2e40b9783667134
ee53acff-0489-4593-aa91-3529e00db98e,2331,2341,20241016,1,Simple rate book stock idea test either former purpose.,2024-10-16,2024-10-16,368450b3b14c0432ebad8ba101169d15
863eaab1-569f-4468-b7cb-4eed08a27cdc,1417,4774,20240702,4,College form sea and theory take window north world everyone.,2024-07-02,2024-07-02,3b1dca592185b57ff1a5cfe44a34dede
5b8aaf31-c538-4870-b041-be3590df23f2,3576,1914,20250404,5,Certain world media if manager thousand tell certain character page.,2025-04-04,2025-04-04,a989d39814f2f937da2faddddeca6fa8
78a7a9f7-fe46-4a03-848a-4db1127c09d4,181,4718,20250216,5,Finally face surface compare will its act however question.,2025-02-16,2025-02-16,56785bbfaf9d3c94cb08adcd75a90dc4
efbbb295-a82b-4549-ae1a-851812d4d875,740,1443,20240920,2,Movie quite memory require type season himself student.,2024-09-20,2024-09-20,372e0b58db935ee2245ba7837f5984fe
f905f584-3636-4568-99b2-c4b141dc2c20,4520,318,20250315,6,Choose college move back effect whose food.,2025-03-15,2025-03-15,edfe73bbd9f82a9f1f05c353ecbc41b6
bfa54629-a95e-4cc2-82aa-6d709e180fe7,1350,2897,20241229,8,Ago month commercial play three improve young provide guess.,2024-12-29,2024-12-29,490084c4cf4815f2653a79f0663b08f2
17947447-a13e-4750-b201-75052dffd841,4684,2597,20250422,10,Support serve attention house forget ahead pull manage mind.,2025-04-22,2025-04-22,91bfe66fd47945226620b9830ac751c3
9c19477a-529a-49d2-a8a6-d96252f6ab30,4655,501,20250417,1,No record opportunity same.,2025-04-17,2025-04-17,4b193c426aa7b81c1e4002bfbd7b50e0
540e7e92-67ca-46eb-a9f1-4b0b642971cb,2313,3920,20240725,10,Religious produce family long whatever cost wish.,2024-07-25,2024-07-25,2f1bc1c931c09ef228c1543bd419c355
b8791288-9f7e-4417-a955-b7428e79f4ce,2072,726,20241220,3,Character customer since current thought dog success beautiful although drug within.,2024-12-20,2024-12-20,491230744fef1c67091146719d3f4ce6
07cb5fc8-2284-4437-b8ae-7591ad927606,1939,1261,20240720,6,Important fast true daughter most describe usually ready.,2024-07-20,2024-07-20,4ce2e3c77b8c88edb9a559cfadc5aa7e
b2e5a8ff-2f40-4b09-8afe-37244483e3e9,2478,3332,20240831,1,Hotel available offer sing boy.,2024-08-31,2024-08-31,74b7b6fd5ba79f483fb9ce3003492152
