SatisfactionID,CustomerID,OrderID,DateID,SatisfactionScore,Comments,DateCreated,DateModified,RowHash
dabbd604-4435-48b4-9b49-4ce93a7d80d7,3435,3100,20250129,9,Mention or difference as method free likely.,2025-01-29,2025-01-29,ea5fc89f83ef4980dd7d2b61dc06e8a5
e5bcff70-b428-4c25-9286-b89b65d918fd,1249,905,20250326,3,Day apply goal music treat wrong identify lay activity.,2025-03-26,2025-03-26,138c0ebda6e5311a07ce6495c4b5d8ad
8e65cc4d-1c2a-4176-9e2c-a4bb678f468e,712,2755,20240723,7,Threat stand kind stage view state new always impact.,2024-07-23,2024-07-23,cab5012d63bf11a44b8102a95ccf3be4
01e12d07-40eb-400f-98ec-9ec663a3a3e0,2071,4953,20250418,6,Remember offer office economy identify hard.,2025-04-18,2025-04-18,d63d3e83cd2d1c618cc6b0f9e6a073a7
73e408e3-c365-4b42-9d83-fb4dfc55d60e,1341,2924,20240523,5,Control yard low certainly company.,2024-05-23,2024-05-23,b0f448b631de77a8a36fd2078f7f625a
a674cb1e-4516-40a1-b1f0-061258a6b95e,4710,1410,20250114,1,Even to science very under detail any charge cell happy discuss.,2025-01-14,2025-01-14,1ee274186b8025ef9885daa45e8a4084
17f0b577-134d-4af4-bca2-5c1ac81f3c8b,3275,2265,20240909,5,Available much list majority usually fall now.,2024-09-09,2024-09-09,f3feb5694a689ae441882f31e47673b8
b2771562-3e36-4a6b-86ce-af042644c37f,721,1014,20241216,2,Building movie here serious accept oil moment.,2024-12-16,2024-12-16,25385e85abebcc8fae51f4b48f3e8735
93b7d6d3-cc98-4bd1-ada5-ba060e705bef,4040,1603,20241130,9,Only cover after out expect.,2024-11-30,2024-11-30,68c96e9a7981b4a8d4b4ab419153e70f
e04f2337-afaf-47cc-aaae-4d9c3519a0f8,4510,658,20250216,9,She assume story week great can friend remember over at.,2025-02-16,2025-02-16,db68f7b810c84bfd705d686d1129f933
886c3177-eed4-4336-bb48-bbd1ee552d68,1203,3798,20240720,4,Focus trouble agreement agree test anything office somebody.,2024-07-20,2024-07-20,7caa7e22216d15266563618d4f386bae
cd31acb3-b2fb-4ad2-88df-86e23065e305,21,3515,20250504,4,Whose little important product like million.,2025-05-04,2025-05-04,13bb5b4d5c483d1bfc4a04752e2eb35b
91b4b085-910d-4367-acc5-77a053b8cd75,2513,1847,20240601,6,Which economic third box popular themselves.,2024-06-01,2024-06-01,3f44281ce7fe5bc411e02e3a940c10d0
de49dc9b-1002-41e4-aca5-e684631a9c8e,4807,2356,20241121,9,Picture decade culture term by station.,2024-11-21,2024-11-21,6f9e6c18a9f4326c58140c136c899717
67d277dd-1bda-47eb-8444-267627a61392,4119,1465,20241130,2,Let even where his factor rate most doctor hot.,2024-11-30,2024-11-30,ead16e686546c1ede9e497bc9ae07d70
106c7fbf-ab82-4a07-a6e8-ce663787cb08,4328,4234,20250220,5,Rather box yeah run first item talk reach family wife.,2025-02-20,2025-02-20,78c4bab5b7118f3cd0debe072067ccfa
fda8c669-0135-4244-afd4-fd2f31932547,4807,3439,20240605,9,Sort military purpose hope person ready author wind base business.,2024-06-05,2024-06-05,5cf44652282a1df4e64eea832c7122f6
64e646d5-a883-49ab-81b3-b881952208dc,191,3320,20250305,7,Clear image young single land hospital space.,2025-03-05,2025-03-05,1a2fb870e0df0308c42c2c4e37f1d428
64818285-9e9e-493a-b8a4-fff964e2953f,2128,150,20250217,6,Science Mrs help home baby together seat nature.,2025-02-17,2025-02-17,f63c23dbfe015f7de24e791102ed193c
2a8048df-8c82-46e0-94eb-5cceae34f7e1,806,826,20250301,1,Commercial lead over people likely.,2025-03-01,2025-03-01,1ff845c6f7454484136736f28f8a41ae
1005a81b-a795-48a6-805b-015f5b9957f8,1489,747,20240914,3,West throughout need candidate through assume response lot.,2024-09-14,2024-09-14,9aa103a48bfb94e0bfbd297b703c9dfa
afb4ab7f-3c8d-4392-bc12-226fd4a20252,3040,2548,20240902,4,Beyond western budget various sound indicate campaign down deal success purpose.,2024-09-02,2024-09-02,db6414d1e5311865906ef69dfbda872b
595d2d9a-a82a-4a70-a50c-fa71f13c8f89,2286,674,20240622,3,Material ok alone laugh TV quite politics test.,2024-06-22,2024-06-22,38cba712840d6fdeef1f9e07c484d19e
6e44bd8a-c04f-46a6-b671-110e78f1dc57,2025,241,20250222,2,Production budget particularly group beat appear father happen visit alone.,2025-02-22,2025-02-22,947b367f168aeee9b356d0bfa389bbaa
4b4aad9d-39b8-4046-bb0d-1b3a8f360dd7,3289,418,20240514,5,Go test policy what training position.,2024-05-14,2024-05-14,dbd1a9543c2994bc94884d763cee1d9d
96b48a90-2f6b-4f45-8110-92ea7920c82d,4325,3473,20250414,1,Table cultural radio step choice.,2025-04-14,2025-04-14,3f14b831134890d7634cdb71a349010c
3e5c19af-83f3-4c4a-ac4a-d09a9922c33c,1964,4069,20240813,3,Vote day market talk.,2024-08-13,2024-08-13,cc3a972e83b0cca4c6eb44b82bda7f43
ad200896-7dcd-4a4f-9595-89f7a0dc7e20,824,4139,20240809,7,Market subject important employee road every room big piece good south.,2024-08-09,2024-08-09,d7cff41f43affea4fd8fbd45504662e1
b94ceb18-8295-48e7-a718-7ffa0fce5383,434,479,20250102,4,Professional but reason country site bring instead ahead current much.,2025-01-02,2025-01-02,dd9e7b0d1b36b81f50c0039b5cb03cd6
091a7c84-40fc-476c-839a-65b55aa65a50,1337,512,20250103,4,Continue senior head drive put world factor again color behind.,2025-01-03,2025-01-03,756df3e7743e2aca5ab4b8f73632e3a9
10808216-481c-4c47-97f1-c0b3d7cfd61e,861,4872,20240731,8,Year south space area learn.,2024-07-31,2024-07-31,198af370fb864c8a59aecbfe3712ab16
e27fbf34-271b-4eb8-b023-8c6b94119eea,4512,4852,20241018,10,Level major wall collection real.,2024-10-18,2024-10-18,3be20e0770d97fbbcaa90c0d433d1928
22af78e2-6484-4e0e-a447-3f3e74ce84e7,4952,406,20241126,2,Economic car every health case certainly safe protect be local.,2024-11-26,2024-11-26,b81f56029762247d6d1f925a451ab89a
ad7ca859-9291-4b72-880d-06667e9113ad,733,2262,20241120,1,Body home son rock well little guy it just again.,2024-11-20,2024-11-20,79dda0b1e6b2f20e2762fe8513452d71
b616c757-042b-4388-81d3-daf7175ac1fd,109,1720,20241022,5,Attack effort building despite fine question.,2024-10-22,2024-10-22,4282154a231972a70b44017abea489cf
c656c511-4ca4-4026-b3c8-fce2909e6e3f,3890,957,20240604,4,Cost trade help build system then wonder.,2024-06-04,2024-06-04,0f6809ac61f58fad68bdab4ee901bc81
1370041d-7aeb-4788-b986-bd93d258d029,877,4067,20250225,2,When focus wear control agent of series realize.,2025-02-25,2025-02-25,1d3fd6144fd3d872dba78f6c3c38a91b
65be0960-9ee2-4813-8d76-d2d3bacc1c4a,4831,3823,20250312,9,Effect buy best others sport forward situation.,2025-03-12,2025-03-12,6afc593240933d9affa84c7f927198b0
999c3479-0417-49b7-a0d2-bbbbc266f00a,3400,374,20240511,2,Charge seat protect part million doctor we personal college save during.,2024-05-11,2024-05-11,d6e2006dcd87df2dc0bee9a075797103
17ad3756-c1f8-4ea5-8e8e-b7f78318c242,3179,1275,20241005,6,Keep agency necessary star data fear chair really at.,2024-10-05,2024-10-05,82a1b9912cbb91425a862324dbc907ae
4d0fa2f5-d640-4991-aff5-586e1291d3f8,418,4157,20240603,5,Court remain may take question building.,2024-06-03,2024-06-03,6bd83d0b8d676a58cc4472034eb9fb01
0f44fed7-4481-4be3-8f21-c5a50b948639,808,4767,20241003,5,You enough office economic ability seem line daughter.,2024-10-03,2024-10-03,e2120a8650df2ac978a631cca01439c8
ecf1f321-0107-43e6-8b5f-15c81bb76dbf,3823,4292,20250301,6,Identify themselves mission ago show.,2025-03-01,2025-03-01,1cfa9312deccb312fcd6b14358d3dd38
2097010f-2e8a-44f6-89c4-39644daae537,2988,78,20250227,2,Billion your thought assume candidate.,2025-02-27,2025-02-27,4c8e5c33be3ac1606457dc840aac9e5a
da11917d-a46f-41be-8b02-b4d009ba9af9,632,1688,20240627,8,Opportunity recognize above ready any.,2024-06-27,2024-06-27,bc4f723f24e7efdf50038bfa8f2eb744
fa206134-4059-4bc1-a56a-6211a3032d86,2792,1831,20250312,6,Rise since hope environment industry relate.,2025-03-12,2025-03-12,3c12ddc0f4975cecba361f297c7cec30
e926d158-7a7a-4176-88d4-57bcb86c17df,4343,1357,20241109,2,Memory create number create job do order Democrat stuff.,2024-11-09,2024-11-09,84343fa5bbd650ac23b1fbe0025fe0cb
42598a0e-cbf2-4d15-8f6e-5017bb6e196f,186,3872,20241208,3,Hand kid office my key worry maintain.,2024-12-08,2024-12-08,7b1a9bba3be574c7de77d0ed08847497
bc6caa97-a82d-47b8-897b-c3773e47c748,4573,4330,20241117,8,Blue free factor offer heavy dog character energy hot.,2024-11-17,2024-11-17,695ec75a36eb8f47ed569837be94f279
49990926-4337-46f7-bb26-6aff318010d4,4282,29,20241008,8,Blood move plant foot mouth party ability.,2024-10-08,2024-10-08,577da6b4d7ffa2f4eff232eab89dae90
503a3555-9852-4feb-844e-bca5c057ff68,1128,3834,20250105,10,Reflect population city dark cultural out.,2025-01-05,2025-01-05,a42099433eb587babc5508086c3788a0
c8a2864c-df4e-408c-9131-2cf35e3f7afe,461,1858,20241025,8,Affect executive career after south girl.,2024-10-25,2024-10-25,55d93d55c96c12e18b3a276425f205b8
06b50ca1-67fb-4d78-9614-a6a9acf1d619,918,3404,20240607,2,Short music anything probably star wish draw day personal.,2024-06-07,2024-06-07,79b41d5b778acab741f8324d7b75355f
0e3d1aaa-d141-40c5-8ef2-eaf005857a79,3496,226,20240829,9,Better process game we write one wrong parent relate.,2024-08-29,2024-08-29,d67741f95872fd6d2c3b473f434414d1
bd24e51f-8a33-4650-9ef3-9ff41b2daed2,4195,910,20250304,10,They doctor art billion hold knowledge computer minute war.,2025-03-04,2025-03-04,dbcb65d78791fa13da1389f5d59ab71a
d614d68b-3af0-4bf5-b251-a37d817e5878,3851,1267,20250307,3,Hard ten economy lead society eye bar after use race.,2025-03-07,2025-03-07,2ee688eaaa1a0c3c1573ca26825bf01d
969b35ab-27a9-4693-bd42-2320c8b20bc5,1662,4881,20240925,10,Large defense house why serious theory these itself leave range staff.,2024-09-25,2024-09-25,bf790b99708fb8a447f2919bb7acc5e8
997da231-1f2e-4744-ae81-8592c6bd701f,3148,2059,20241110,8,Behavior form realize expert charge.,2024-11-10,2024-11-10,3fd9c88bba4c073854104517d79e71f1
4d8f188f-78c1-4179-8863-846387d124b8,4018,989,20250124,9,War pick always whether reveal happy.,2025-01-24,2025-01-24,07cf28838ac5d09527fc7c000c19200f
233352e7-8ab1-4064-8b12-1041fe2f0e7a,1622,3975,20241111,6,Theory speak church though they result reason increase nature.,2024-11-11,2024-11-11,09ed70d7226457ed19586c18b391e574
98e55cb5-66aa-4728-9044-52306f71efc5,1858,331,20241130,8,Appear office event finish research water success computer bill light.,2024-11-30,2024-11-30,5c097f124f9aaf6c6b05c49ea352ff9a
21eb95dc-43f6-4b52-afc7-16c1fcd4a8cb,3435,4585,20241018,2,Receive clear size especially present edge baby attorney determine.,2024-10-18,2024-10-18,0f3bef7056d55ad5b45cea325f1b6e28
2f5fe9be-fcb3-4eae-9396-3bb61580e790,58,1492,20240511,5,Blue reflect rise source cover history condition win important sound thought.,2024-05-11,2024-05-11,ad625b4915b136fe0849898a110718ee
c279ba75-7f4e-4f12-8227-fd0629d5a010,4482,123,20241119,9,Else threat lawyer activity note western.,2024-11-19,2024-11-19,f1bfaae6d82eae2859aa93557408b6cd
14604b46-3747-4d53-a09b-8e85d129778b,3002,2883,20241024,8,Employee add ask certain opportunity thus ground itself girl.,2024-10-24,2024-10-24,9fbb6190ae58bb562510ad814b7c2bbe
abe5418a-d231-48ff-a4d6-5678532180da,4101,258,20250320,1,Forward plan watch usually imagine professor but class.,2025-03-20,2025-03-20,74976b21289317bbad9be86e60d06a70
cb1f65d9-20f2-4e21-8dcc-d0b20a4bc78c,1391,2105,20250407,5,Already group style rather.,2025-04-07,2025-04-07,68a9433ae5b926e9dbe2ea73e0698247
801cbd6f-799d-43e7-b05f-cd09850acfd2,1591,1106,20240922,4,Any professional after sometimes everything phone other.,2024-09-22,2024-09-22,02644c4dda39780dbd6ec1be1a91048a
a6c052d1-dd60-4600-9592-907ee32a1734,3238,1526,20241203,3,Citizen product teach little tough paper Democrat goal president.,2024-12-03,2024-12-03,3da58c04c709b3a63b6b2e3953991713
3882c65b-eff8-4291-af50-f7c0c15bf77c,996,3201,20240718,10,Cold next economy top can read name.,2024-07-18,2024-07-18,f023cebfb322342cb4d14a7d32855b01
7a875ba2-4ed7-47a6-b005-e379bb75d179,312,3150,20240515,10,Season artist however main wait.,2024-05-15,2024-05-15,24892e76b1c465e4eb708bc2587f6761
d149fe68-0058-4a9d-912a-b0c36257b492,3133,4518,20250202,6,Nation mission onto drug decision rate.,2025-02-02,2025-02-02,0b463b61fdcd1cf65b172560fc9e13f6
6bcceb39-bb46-4412-9b42-e020b2baaa33,3735,2127,20250403,7,Shoulder course physical wait material real card next.,2025-04-03,2025-04-03,4a687763a653a235f7f9af4c04d12e3f
95cf07a3-2686-421f-a3f0-2309ecf3057b,3868,164,20240601,7,Serious enjoy artist happy there less.,2024-06-01,2024-06-01,6ee1a945bbd0fd2f1988f5d5aa05c53c
716d3224-7bda-469f-a4c7-aa4b5601e7f1,3625,2921,20240513,2,Than save then note specific natural leave.,2024-05-13,2024-05-13,8f88c70f519f3371d62067caffe9e04f
87aa2e3f-2387-4468-a5c6-566b24fce755,3580,970,20240630,4,Science force note forget past white country.,2024-06-30,2024-06-30,d8a9734f3101a49d2db5085fe95a4463
26d51e62-dca7-438f-b2a9-842713687a98,4736,2988,20240814,3,Event push whose security note section result.,2024-08-14,2024-08-14,571e9f6a7e70a36390fc8c6200979338
5608b508-51de-48c5-beae-6da5b80108d4,733,2637,20240813,1,Rule name during cultural knowledge miss daughter probably force modern.,2024-08-13,2024-08-13,2168b4d86f1eb8d8168ee912961624af
cd0afea2-8c85-498c-9d7f-96b6011cdb02,946,3331,20240914,5,Claim pick speak various own fund security attack west movie.,2024-09-14,2024-09-14,ab7d8386f22c64a8755164ce6b2bb1b0
9d0d5339-2611-4b72-a1fc-b69208327b7c,1190,3182,20240913,2,Free glass improve ever feeling suffer these leg appear indeed hot.,2024-09-13,2024-09-13,00588077a6ca2bd7fae8c50a9111eef5
3d2053c6-7475-437f-9417-782889670a3b,37,3935,20241106,1,Everyone model art strong most.,2024-11-06,2024-11-06,14f8fd9b70936d2b0a5dcf9e2a56f175
f25ad1d5-366a-4ab6-b7a3-879c8b0de956,1783,1619,20250109,6,Why until must will board.,2025-01-09,2025-01-09,3922b2ca8954b666be57c32bb97c6606
1198d6f8-164b-46f4-8e92-d83e0021fe7d,381,4282,20240704,5,Factor picture kitchen Democrat player lay sign occur dream affect effect.,2024-07-04,2024-07-04,2f22c13c9b22e17685461c42ff1b918d
f58e0a06-924e-4bb3-9267-20d84f4ba254,1283,2311,20241101,4,Box style current law team.,2024-11-01,2024-11-01,bd4f98c327ae97d5ccdfd19595e1061a
bc80644d-4023-4e27-aeed-99fed1ec5052,922,4409,20250501,4,Option only better manage north again forward.,2025-05-01,2025-05-01,ecdfccfd82ea5afcf4050097cd211092
23234da8-642e-46fa-80ab-122d828059d1,4735,1122,20241222,5,Describe after appear community sea within week coach tend.,2024-12-22,2024-12-22,0fa607c5e5427a63ffed14672e366101
f3abb477-8a54-4bce-9411-6b575e5a2595,4439,2399,20250428,9,Happen minute author nor eat campaign available determine.,2025-04-28,2025-04-28,65df244514e595bf0b9c5826b1429ad4
9d380f75-bfc0-40e5-a072-c64efad5916a,541,1806,20250205,1,Meet pattern treat attention if tend thing address some.,2025-02-05,2025-02-05,cff27faa4d12ba1a0998fb7825bad4bc
00466813-7506-423f-a766-97886c707b3c,84,2470,20240610,2,Focus worry city education under newspaper score western PM go.,2024-06-10,2024-06-10,c1ab89f7b99240a0e3d87273f6bfeb53
6c98e959-b359-4d33-8323-9c225bcbc54c,3483,4921,20250315,2,Rise note meet produce personal will.,2025-03-15,2025-03-15,f68c4c059629c2619cf9b2fa594ff928
b0ac8c44-e3c2-467d-a3cd-01c0b1daf0ca,127,2592,20240923,4,Role finally hair family success now.,2024-09-23,2024-09-23,10e49e8dcc72a0565c6d30b71db1099c
63282507-387a-4390-a054-2ded296ee664,384,1208,20250424,2,Among music shoulder likely performance top.,2025-04-24,2025-04-24,77d49fd7add802ab381e954cec8ad056
371a2bf1-58e0-4edc-8991-d70c3ae29049,3018,584,20250404,7,Establish image author difference program study who.,2025-04-04,2025-04-04,2c21334adee13570a738bd0208f04d9b
abd7e5ba-d433-45a9-b8af-4c132f3d7511,3902,2988,20240715,9,Lawyer feel professional follow eat different heart first.,2024-07-15,2024-07-15,147d9dc7cdfcc4e9d01e0b6cd657ef6e
0dd66822-ed9e-42ff-a246-670dece9e921,3180,2383,20241219,7,North key nearly ahead research consider better control cause doctor.,2024-12-19,2024-12-19,0293c477fc43d85c7f59a0b954f5d6c8
420f2158-b2fe-41aa-9da6-ff5c8a962d4b,2008,1894,20250408,10,Room treat current seven month instead.,2025-04-08,2025-04-08,1136fe005623b59f2b9f8b5ef6f2349d
c31938f1-37ac-44fb-8f84-4d5d0f0c8c40,2704,1907,20250509,5,Book no cover worker strong fund billion man behind.,2025-05-09,2025-05-09,26a8930793deae73d13ce221c78188b0
d51fd13a-9859-43c8-8109-13bf5da2100a,4506,744,20250309,2,Check popular fly could law poor deep financial.,2025-03-09,2025-03-09,eb6266aff79d8293914d50cfc9e75015
364753ba-3707-4d10-a03f-82d090d335a6,26,2670,20240607,1,Various themselves thing prepare picture.,2024-06-07,2024-06-07,dc402af9cd8e06e8aa43a1a596e555b5
88d85373-72a4-4394-9307-5c0b32837ee0,971,2263,20241110,8,Society before which father art leader notice painting field bar game.,2024-11-10,2024-11-10,3283de0a217a161c7107adf444914202
6516f050-0850-42a2-b587-0123e592508f,3446,2127,20240713,3,Represent perform book question figure go visit image shake.,2024-07-13,2024-07-13,d8d6ad15617c0dd37cb2eddc18a06508
6e2f76ae-d837-43e2-a809-08afd4792b47,4019,4142,20240810,10,Conference watch according interest.,2024-08-10,2024-08-10,c26c5776ba6d5ed139a08fc84ddc59b2
3e983b48-6d58-47cd-b294-d0a9232eea95,3478,1002,20250225,6,So prepare country anyone career against eye challenge.,2025-02-25,2025-02-25,1cc9e4b6bebb4d3aa0cdb0b8daab1caa
138b556c-8404-4612-a61b-7ada06d389ee,3871,2022,20240827,9,Too act choose visit yes may first yeah cut.,2024-08-27,2024-08-27,6cc91dc2844bdaf6d48168a6cdac8091
5b517fa5-18f9-4d6e-9d1e-2a26d3de8297,2761,2630,20241114,2,Fast after past cell apply against.,2024-11-14,2024-11-14,95b917e39624b5e91151e2a5d4edb7d0
38388c6e-14c1-450c-bc29-569e78d8c0b0,1121,4473,20240911,2,Quite thought follow assume notice civil paper everybody heart detail.,2024-09-11,2024-09-11,e14a2d47a4bfdfaf4e43c1574aedc2c2
ff6259a7-af1f-4e0a-96d5-a5703702ea8d,3679,4037,20240518,6,Open school unit agree majority present.,2024-05-18,2024-05-18,fcde71a5c6c0614ae1647fea6d06271c
9a6de935-a069-4eb0-bb18-0c9eab9aa11e,807,1098,20250502,4,Degree grow box reduce who like minute interest actually scientist.,2025-05-02,2025-05-02,93f0c697470583df758935954afcd03f
d77122cd-8e75-4374-b427-719ef0bcd452,4852,3049,20240716,10,Often manager court news company edge admit enter I.,2024-07-16,2024-07-16,f89a19a91eca09cb9d63fd55c6a36b82
76862145-c383-4480-8542-6f62dc224a87,4078,4151,20250108,2,Budget goal believe local.,2025-01-08,2025-01-08,bcd1236272dea4d9a584b0fbe5e20a64
2d8c6b16-10e5-4713-a100-cf733c6e56ae,2797,2968,20240826,5,Suffer allow popular you this source suddenly middle group.,2024-08-26,2024-08-26,50e991b2d02d8dca432232086e8e8f35
4181b35a-15fa-4871-8a49-6e177ba6604f,1268,3084,20240724,1,Into risk prove participant individual according compare affect not.,2024-07-24,2024-07-24,3a69668ca847cfa63e6d36bfa79018b2
01ea904e-1140-47b9-ad48-2e139ec8ccb2,4904,3784,20250411,3,Practice business other role provide kitchen full performance father weight.,2025-04-11,2025-04-11,85fa7cf96821449dd65185ce7909c7d7
169aa240-af35-4649-8cb5-6dbc96ac9f77,1861,3141,20250423,1,Next news friend action sort.,2025-04-23,2025-04-23,97cd017c2ba8b64d1c4593f2fcda6dbc
193d80f5-afae-4a3a-af09-37ca83de60f0,1258,2422,20240713,5,True of agree television new.,2024-07-13,2024-07-13,2fab7dc48489e755359a63d0ad8f7e16
0f9705a3-1d5a-476e-8adc-0ef3ad0dfd78,3565,3030,20240517,5,President newspaper only imagine require expect church speech nearly discussion.,2024-05-17,2024-05-17,8e9654de3a7bed911378bd4793cde4bd
11b06df8-b693-484e-8eb6-14222e9158c0,3464,3790,20241210,8,Determine collection hand hospital smile fast current.,2024-12-10,2024-12-10,90911681e05330adefee259c9d5868cf
9b5602cb-cdae-4c82-a92d-a16229545af1,1158,301,20241231,6,Inside mean pick campaign during believe short list trip.,2024-12-31,2024-12-31,2789fd33ffe9bfd3f52fde5a5b6d2b67
0dc395f5-6dcd-4e11-8e41-8cd3f779cb91,530,3618,20250208,2,Smile parent green foot language fine.,2025-02-08,2025-02-08,c27f30b1c07789260c1c59ff3a5e4625
cd69e913-ab56-4939-87bb-e62b32b7d74c,224,3774,20250313,4,Director all travel reason education country offer air today policy.,2025-03-13,2025-03-13,11a393e36db603be97555c23de22f36d
38bf7bd4-7b9c-46bb-b7d8-ccf60d4057f9,501,4097,20240825,8,Eat number notice real able throw wife.,2024-08-25,2024-08-25,5e9d540bf6228a8599a7609a83828115
282f9b88-c1c2-4ce6-aebc-fba8833ac516,1004,2963,20250509,7,But certain question laugh prevent price.,2025-05-09,2025-05-09,c2bc5c075932cdbdaf2fea1e404ca63e
0b514010-22d8-4ce4-9454-e20de6316dfb,2160,3938,20240710,9,Moment wind part listen arrive Congress.,2024-07-10,2024-07-10,1ef30f38863d9f871c0e4fa4882d4a2b
39220291-0f29-466f-b796-d929067f8e7e,1884,3942,20250128,1,Air play catch interest set air student expert these.,2025-01-28,2025-01-28,58663cee71c6d6cd2f045dd289401455
4b235a66-0042-4f34-91db-45b2a0193cb7,1774,801,20250321,8,Set travel reality listen poor front throw drug.,2025-03-21,2025-03-21,292dd178a162b72ad7f9301841df713e
1d24b76e-bf8c-4591-a657-fd597cc19ce0,2606,2515,20241010,4,Professor machine day idea far break.,2024-10-10,2024-10-10,233808eb04923db202dd24c073a3c137
e7ddae66-ab6d-4854-9532-1bd32c9f4da8,4343,131,20241209,3,Republican their produce civil college rest wait spend.,2024-12-09,2024-12-09,3277e329c7f53007250cf3161e4bc95a
09a41ba5-bcf5-4387-ba4e-478a6f3ea6f8,3624,2429,20240822,2,How bed whole far strategy scene never.,2024-08-22,2024-08-22,43a866e5177a081b6de6a191e0e8b192
7010359a-466a-47e9-9477-8693e3e78d03,2472,4123,20240531,6,Job third ok bar approach these billion listen five reduce.,2024-05-31,2024-05-31,7b07c6064cbe33d7baec407ec15d0e61
480117bd-0e06-4929-9af2-9e84d8950ca9,3761,1484,20250212,7,Sign point many act agency upon true community customer.,2025-02-12,2025-02-12,d0e617e74e61c642d48a6e052f1621ed
6216630e-2b23-488a-af28-292b4c4ec634,409,1328,20250404,10,Significant no expert bad hot page make present.,2025-04-04,2025-04-04,adf322c576e8ce416442c14345b01a06
ccec1efb-6aa0-4bcb-9dd2-0039ae5bf0fb,1416,2723,20240813,5,Organization question audience difference recent traditional interview election again during.,2024-08-13,2024-08-13,3d69b01b81c9d0287f0839ad2f1030d2
080a1c3f-e8ad-4006-b7db-b90da3f53bce,3232,4327,20250211,7,Late interest mind majority operation develop over away.,2025-02-11,2025-02-11,aa51faa7b7b52f22b887edbb483de4e3
f38762b8-bde3-4926-9ce2-af28d7fb04f6,1209,3694,20250430,3,My whether even heart machine.,2025-04-30,2025-04-30,da19ff02859f15ccf8982cc5c3f5456d
7a24e1fa-bf23-453a-a108-d518c90a6a0f,4547,4229,20240819,5,Might that thing time beat to best.,2024-08-19,2024-08-19,1564976b4b4274ee6a5c8b4a8d0b8006
67f72ae4-5acc-4f79-8667-cdae8f2134d6,375,3676,20250323,7,Low over training someone show partner during.,2025-03-23,2025-03-23,af019ebcfdb556c8b1425b8684f69164
92a9e359-b350-401c-a7e6-b8261463df73,3512,2054,20241201,3,Dark three eat chair agency former know character.,2024-12-01,2024-12-01,5a0d47e9c21d8259a99688dd11b0f03c
ff38b715-3f5d-4bef-aa9b-258cdee22174,85,3649,20250505,7,Reflect left history image travel.,2025-05-05,2025-05-05,18c1cef636efd3f7adda71ca618e35f9
ce572d9d-e767-4f60-9d88-68dee339554a,1695,1179,20240813,8,They response son similar community reflect.,2024-08-13,2024-08-13,15163f76c533762e1406c8419b2549cc
6f3b36e8-b2df-4137-aaf6-29d079e0a4a4,554,1692,20240619,6,Itself hard own up degree enough quickly man control effect.,2024-06-19,2024-06-19,bdcfa634f272c2d93cbee0bd1dede1d3
9492c683-c526-4ad9-8d45-3a29e158c1e1,1706,4494,20250217,7,One operation wear cut effect history should.,2025-02-17,2025-02-17,b14198bcc28e75794958fc9d64bd3839
c7b3cb8b-ac12-4df6-a9f0-615f418dc7f8,3899,3421,20250308,3,Important theory film federal decision economy.,2025-03-08,2025-03-08,b711cd5965ede58762f0a7947b136718
6919faf6-e349-42a8-a148-a5270e565ce7,2934,4946,20250428,3,Suggest you front tend.,2025-04-28,2025-04-28,f5927251658f0995b18924eaae1b33d5
a630d22a-17cc-4975-8415-4d976175c6c0,1785,4334,20250429,7,Particularly action other PM make then necessary write first sense.,2025-04-29,2025-04-29,8ccd1f4fa1b3f07e4c72b445b78c0f14
3430a4d0-4f35-4ff8-bed1-ed3d1e42f8a4,4129,3893,20241014,10,Yourself smile crime full read travel story age bit mention.,2024-10-14,2024-10-14,d784745bb8d5f18d0bc5291049d13bc9
cd41eb8b-21c8-4768-b5a9-36ef8ad30095,427,3330,20241016,1,Food also into live card baby though race.,2024-10-16,2024-10-16,b61859e59c47b346bdf77cb3cbc18737
5a3d2715-4b48-460f-89fb-354052d2b082,2157,4236,20250313,9,Animal actually land group maintain issue.,2025-03-13,2025-03-13,c3a493e318fbcc08efcef286bd86bd89
c4994997-79e8-4a6a-889e-254ef3616697,3223,4845,20241011,4,Give ball deal direction fast even visit kind scientist.,2024-10-11,2024-10-11,1487aad899165767d31869ed6b17e7e5
74706fbb-75be-4c4f-a5b5-e4ebcc5b6368,1445,472,20250225,6,Discussion relationship notice impact easy near.,2025-02-25,2025-02-25,3d3bf044d6f0eece93fe00c8dd466451
c8ba1add-2108-49d2-85c7-005945f72105,3036,1928,20241024,5,Consider west style when world management.,2024-10-24,2024-10-24,03764f878ddcac526afd208a5c07e515
219603b9-69c6-43ad-be8b-152855349496,50,2842,20250307,1,Loss return wide education education give southern how.,2025-03-07,2025-03-07,e1c1d2c72812334c54bcb6da19439261
e9cc7d54-91c5-48d5-a9c9-dbc6096b5e5e,4300,4948,20250504,3,Coach stop see page program buy get health gas somebody.,2025-05-04,2025-05-04,7a240c06939858876297e380fc14b01d
2ce1dec8-0f33-4492-8d30-1380a47a85e5,3886,1639,20240718,10,Team lawyer new picture if election nature sign entire loss try.,2024-07-18,2024-07-18,17140c7cbd8c3d9cc1c75382b74eb57c
c8826267-9326-4a27-97ab-ca16fcda38d5,3426,687,20240803,6,News on skin approach personal less.,2024-08-03,2024-08-03,a81e08b139e0598463de29fcc92b1f7d
f57eef51-8be8-4d51-8239-d962d92b5a08,4884,3682,20241008,7,Push history suffer than enough bed.,2024-10-08,2024-10-08,5eaa798d986ba497b56ad073fbbc7701
e8a68aa0-77a0-473f-b4c2-328802b5c251,2109,73,20240911,6,Cover style late wind finish.,2024-09-11,2024-09-11,3acf354794c749423da25405e4c7ff6c
e76726a5-21c2-4735-8fb1-d7e86afbeb75,1572,2636,20240904,7,Computer successful at she agency.,2024-09-04,2024-09-04,38e8131244d5e0c51a43ffa3d859120f
ace6db33-d73c-422d-8edc-e9181bc13a06,3689,474,20241118,8,Discover individual floor quality lawyer shoulder week until less.,2024-11-18,2024-11-18,aca561c07a13ecb3b286a3587808292d
