SatisfactionID,CustomerID,OrderID,DateID,SatisfactionScore,Comments,DateCreated,DateModified,RowHash
780479a2-485b-4f2a-bd99-c4507641905c,1717,2616,20241020,4,Rest successful show really race.,2024-10-20,2024-10-20,5bfd08eb56047bf25d2938943bb54873
a18b2e15-2634-4abb-bb10-4bb93a9a2a24,612,3486,20240701,1,Same story skin speak magazine crime thing form.,2024-07-01,2024-07-01,97b9e372ffef1b22696c88a3ed0c3a47
67cf6f00-d1ff-4f1d-a668-78159fc2a34d,3917,4633,20240512,2,Environmental ago return nor as position rise stay.,2024-05-12,2024-05-12,787a0ca9af1b0578b3a23960128c5db4
b7d5edfe-325c-4193-8cd8-cffe1d7cde47,3979,4848,20250221,2,Huge none fish you.,2025-02-21,2025-02-21,819da83a16bfde7a38f3fbd870751440
de57c391-8a5b-41cf-9194-dc5d8c7781ff,1683,4453,20250102,7,Relate age claim Republican support.,2025-01-02,2025-01-02,19f73d9b2e26fe945bb50637b15c4908
06a40c07-cd27-4306-8572-0a7f3ef664ca,482,655,20240821,6,These beat fine move husband.,2024-08-21,2024-08-21,837c233aeed1ac3a8b76ca40142f26c6
e3750cb8-4207-46d0-b11b-503057583d8c,3937,811,20250426,2,Mission discussion read top ability world.,2025-04-26,2025-04-26,6db1f003a4a2c6b50f74b5f0cb9ae171
9c8dc526-0d3f-4928-b88b-232d015b8c26,4060,951,20250104,4,Crime imagine western contain like degree attorney space determine mean.,2025-01-04,2025-01-04,7304c043df52cb4b889724934a2a4419
366ca194-1300-48ad-bceb-983f3fcaa32c,1108,801,20250320,10,Game case life test name likely use Congress entire.,2025-03-20,2025-03-20,917c990ba5bdf24ae39360c2fa9004b2
63c5959f-209d-4288-8e84-34d392a85846,2535,133,20241027,3,Quickly TV situation option safe case fight beyond leave share.,2024-10-27,2024-10-27,07336ddd1f036cf24f65f874b875d768
33276ca6-9406-4cc5-a264-0a81d7349ed2,2486,3801,20241231,1,Indeed environment painting recently notice two.,2024-12-31,2024-12-31,aa0ee152e05e5d4c9bd247c62ac0940d
8e53a7aa-975f-46db-9133-36d132f916de,1324,4267,20250407,9,Design very financial once present finish pass up.,2025-04-07,2025-04-07,f5056e1263eeeeba80329c11b9d4b8e4
f9416010-5182-4570-a50b-82ccf2eaf686,724,2371,20240914,2,Term half sing wind spend establish.,2024-09-14,2024-09-14,9fd08dbb79d28e0c6ed85723b4412296
3a975206-1363-4575-bcc0-e474959ea7e3,977,1086,20250102,9,Every place region several report.,2025-01-02,2025-01-02,a5ad1fd1a1d5029ae949bfac814f46c0
6938a69e-8b2c-4b6e-93a0-0aeec7c89918,3764,2451,20240623,6,Bad need safe understand.,2024-06-23,2024-06-23,820bf0cadcd946f736027a7a1cd21e50
857cb599-088e-489c-923d-f4854ad17bdb,1120,3970,20250323,2,Heavy raise go pay film best.,2025-03-23,2025-03-23,3ad2aaf3e45913470156b5132a524db5
9eed275a-d5e9-45b4-945d-006141e6020c,4978,1746,20241118,7,Option thank stay him why hear.,2024-11-18,2024-11-18,a60823c511049bcbc9b6d31fa5865444
865e87bb-0601-429a-9a42-276c9de5d1ef,3903,4179,20250201,6,Meeting power customer line above often manager determine board yet seem.,2025-02-01,2025-02-01,bfd490a6e11edb30025a90590816d9d9
51101aee-fcec-4138-ada4-49eda7e2c547,4022,3118,20250109,5,Step performance many many believe north something information.,2025-01-09,2025-01-09,bcd116139b10508a19274a064716f998
793e28fe-7e28-4e43-86d9-ff69d5505433,3512,1537,20240908,10,Arm check if economic believe.,2024-09-08,2024-09-08,31ad36f372406380e60c61284c251044
fe63dd23-15bc-4c36-80d7-acc4de53fd2e,588,1957,20250315,9,Understand dream bed type mission.,2025-03-15,2025-03-15,e60ceb63872f99f35955ce97eab429da
fdd55798-3df5-4399-a0b0-3d7db373b4a2,653,308,20240528,8,To live night sure gun rather bit.,2024-05-28,2024-05-28,6d5add79c4824133a5c8b9a2647a1b86
81d1a2b0-9254-4c8a-81a2-bb45a7e07c16,2472,911,20250417,7,Pick coach wish any minute never prove rule senior kid.,2025-04-17,2025-04-17,0324a7909f918139cb64556c3f48a582
a6af7d2e-91f0-40cc-832d-816a1f1b0536,1001,4732,20250302,5,Third also financial special animal moment almost.,2025-03-02,2025-03-02,276589cf8ec2bef5ab8b174132db6a1f
d22b25b7-86c4-4979-a766-9f4224bef80e,1388,2044,20240831,3,Bank imagine age reduce week special look trial politics market.,2024-08-31,2024-08-31,12140c703acbf27500af2321df728ef5
504bd27e-56be-4e0f-82bb-ce0a9f3b1b3d,975,2854,20240818,5,These central action another while single.,2024-08-18,2024-08-18,8dcabc1690400143db290f41a9668ff5
ab98cc50-b52e-4d88-9f01-37286de77198,393,624,20241227,4,Prove hope our season sport major everything.,2024-12-27,2024-12-27,801af5225d5aeff73a414899133023fe
871c3272-cde7-472c-85be-e623723aaf0c,676,2749,20250325,4,Enjoy radio community deep join indicate short or.,2025-03-25,2025-03-25,e6ac5c7ec55f4507ad52dfda53cbdd4d
a0c0628a-a630-4819-b08b-f958730b18f7,2716,422,20240724,7,Kitchen once interview reach despite us ten.,2024-07-24,2024-07-24,f285bf070160bd55b0b34bb23354c2eb
a3e2d33e-eb74-4434-a1cb-b96554ef6277,4890,3550,20240630,3,Reflect guess thank bad song phone walk model sport myself.,2024-06-30,2024-06-30,c0fd64e147b7feb98d803664c7a1a542
f954172d-7ec3-4079-86de-2e15ee5b5b58,3183,545,20250211,7,Nice catch entire son rule.,2025-02-11,2025-02-11,ba68ed76cabc82055dbe4c1cde1fcb8c
51a30dc8-c35f-4265-97b0-51ba71b0ca78,4489,2075,20250321,6,Type operation base contain.,2025-03-21,2025-03-21,2e50881ac43ecf450ef26e35258bde64
ec4cb6b8-5c86-4cfb-88ba-1096c3ce6d6d,2762,1370,20250421,6,Low fear daughter almost culture fund really.,2025-04-21,2025-04-21,049595e69eb4070ac0186bfc8b3969be
bd700f1d-f07b-4410-9528-3e6244538c66,1438,4071,20240829,5,Only scene every among.,2024-08-29,2024-08-29,8c78844eededb2738775331dc13589d2
3d1f2b51-9180-41a2-8290-18be9255f842,615,17,20241218,3,East security tell inside fast team although.,2024-12-18,2024-12-18,f76a182903d62eb84246825d962cf127
551637fb-70ad-4335-ab8e-9ae3752fcb6d,2977,2319,20240908,8,Best weight number brother seek them pull station job.,2024-09-08,2024-09-08,07fbf52dbba6d87df3fd8ad871b9e485
1845e25f-e100-41ee-8f9d-129cb617043b,533,3822,20240928,10,Really likely development second ahead choice pressure long floor.,2024-09-28,2024-09-28,f49cfcd6a5d872c6497c76596cb5ad36
467fa162-96d3-4b42-a4a7-dc8a45c71482,4447,4893,20241118,10,Rich financial all indicate front themselves.,2024-11-18,2024-11-18,cb799576e3cd99e1b4a92176681bf0a4
8e114a6d-14e2-4446-8aad-7bf265ce7572,2261,4265,20250426,9,Marriage let term network camera.,2025-04-26,2025-04-26,4f34cf8e67399275d349c7550eba8f31
a194cb26-9d3c-41e1-b8ca-5559a94be1af,2941,3490,20240610,7,Who build certainly heart audience call still.,2024-06-10,2024-06-10,c7310ec8f3fbeebe9f2d094c1380a120
0978ca9e-5432-4cbd-9ad2-02aa1a884e2c,4953,2313,20250307,9,Write also animal bit free these federal above point where.,2025-03-07,2025-03-07,14913c6985b645c4ef69c4deaad51649
d7220e8d-cef0-474d-a73b-be7e37326967,4672,4898,20240817,4,Great design effect kitchen happy thousand cut prove both executive water.,2024-08-17,2024-08-17,2b8da6a13bd93e5698309cd629bb7c80
2c99dc03-7cef-4670-8e78-a17ba2d2c9ed,479,251,20240721,6,Page interesting week season person yourself structure relate.,2024-07-21,2024-07-21,a6de087187d1b04fe11f0a4335627fdd
e2a344f4-e676-4dfa-bc4f-33f1e689d424,869,4841,20241010,6,Shoulder newspaper chance member son.,2024-10-10,2024-10-10,e745cadf2c2a755908ccda9d97497aab
e06f1ed1-c3e2-4574-a863-21c6a1761732,3545,3699,20241215,6,Much factor little tax whether available daughter turn audience.,2024-12-15,2024-12-15,e0a5939567eaa32caef139d3215fb965
2c76297b-3daf-4529-bcf4-d866051d49cb,3293,1706,20250204,6,Three reflect finish drive wife perform long voice.,2025-02-04,2025-02-04,38d3554167fe40e9e4874d1d17c3629a
f4b39c1c-2e65-464a-a24a-ddfd342d01ab,2983,4136,20250201,5,Else religious if study.,2025-02-01,2025-02-01,7201c553e9ccc8422d5a11a5dae5113d
b8ab50fc-8867-49a5-aa55-6c189770ce8c,1194,1510,20241206,8,Natural apply exactly audience whose.,2024-12-06,2024-12-06,7d92e027f0c404fd053ca706f59e8c2e
2ede61c7-8852-44ff-ad4f-83b21532243e,708,3733,20241228,3,Form who support only population down.,2024-12-28,2024-12-28,a6b0fb2591ae69b22b4f7e2775c7256c
2a4fee65-191c-47b5-8e0f-508820796946,3193,3312,20240604,3,Reduce receive half produce information student piece.,2024-06-04,2024-06-04,5df552c4dbe2eefcd350e8109e4c794f
1bb74abd-b12a-46f7-857b-03773c2de149,2963,3319,20250114,6,This bar important never maintain short everybody the back.,2025-01-14,2025-01-14,b0c170eb6144143bbe5888c53d1a1095
2195dda6-8ebd-4b5a-893f-fcbec6f4cbe9,213,2122,20240617,7,Building relationship on finish particular shoulder movement suggest.,2024-06-17,2024-06-17,eb5d195836c10d0b17224bb1326312a5
4c8309c6-8fd0-4120-bb64-73e9dfa9efcd,66,3903,20240621,1,Whom story economy mission process another.,2024-06-21,2024-06-21,1130a4a4652c5e651aec4398337b4e07
c36f1fdb-cfde-4fc7-bf36-ddfceba5b2bf,351,680,20241206,5,Outside anyone apply less doctor officer very peace up concern.,2024-12-06,2024-12-06,05bf1f4697bb11b7eaa236408b31a1b5
aa933534-b3b3-47ab-bae5-f76f71ba636f,2249,912,20241201,4,Building whatever according brother writer upon.,2024-12-01,2024-12-01,b2a3f44159ebc9764150031870075ebe
033e25af-1c45-4548-8eb7-b3f0fcd77871,42,3098,20240726,9,Rather moment then leader region board door.,2024-07-26,2024-07-26,3d8cbe236977ad4294b78761b9c15d38
3287c5e6-0e1e-4c2b-91f8-e516457f3384,3449,1475,20250418,5,Former you keep outside method amount.,2025-04-18,2025-04-18,83d817869b976c8386152b2640a55410
21c58b89-bb8e-499e-9532-2f21d222158e,332,4194,20240906,8,Order lawyer marriage candidate describe.,2024-09-06,2024-09-06,96dd137594daff418d5a5d77b1f15c74
67636614-c0ec-4652-beba-874b0eb97f64,841,43,20240515,1,Top bring fact remain mission also data yard voice.,2024-05-15,2024-05-15,2db711e17bfd627f2cef8214e4e906e4
9f2f57c6-2d88-4e0f-8af6-472b40bdc31d,3374,3352,20250214,9,Since health PM try time professor when.,2025-02-14,2025-02-14,ff4259028db05365c598bb690e378a26
dbd2ae61-5c21-45d9-8974-554f8fcfbeee,4912,484,20241026,5,Budget executive reflect purpose Republican wall.,2024-10-26,2024-10-26,a2d9254a882c48d9450cebbd2321a8b4
1d672989-d051-4ed7-9705-fb1ed1d76f43,822,3981,20250105,3,Smile control rule one see single move statement American good.,2025-01-05,2025-01-05,2795b3b79852276e597564a254e59bdd
e0d2c670-06b3-41ff-8334-6d739a504dca,4394,1153,20250501,1,Join guess heart identify his recent involve moment article.,2025-05-01,2025-05-01,a67b885d464338f6bc769f4aa5badf73
c05ace89-dbf6-4e32-95ba-081104949ab9,3865,3340,20240604,3,Often table paper understand man.,2024-06-04,2024-06-04,cf503637d91d00034456d588c7053860
88931f27-72e4-4516-8054-ac88ebe4e26d,1575,4109,20240729,2,Move control answer everyone action guess decision.,2024-07-29,2024-07-29,17276ee5ecc4ccfb1ec098377b5a7cfa
55a73cd7-5a81-4a30-a4f5-ac1e30f4f583,998,2877,20250221,3,Plant cup grow charge ground order challenge talk.,2025-02-21,2025-02-21,78708f2f0f6ff1161fbf43059efd5ae2
2605658c-08de-4e5b-bc1a-591f0269e1a0,1147,1879,20240729,3,Agency single wear financial professional Mr economy from must.,2024-07-29,2024-07-29,6485bcc3bc5130d389dd44807cb6b687
62127262-99f0-4d08-a6e8-39dd99b90b45,4524,1214,20240801,3,What several account out set.,2024-08-01,2024-08-01,60670cfef3cf94becf001a6cf7e50bf2
7a881943-6bee-4adc-9c35-14409f562bce,1434,4556,20250122,3,Person could across though left.,2025-01-22,2025-01-22,8a79044847c62a5b0a21c0db843a13ea
6e5b6074-d56f-404a-98ee-a0368e8cffc4,2326,108,20250416,9,Same other measure give unit group someone relate.,2025-04-16,2025-04-16,bc84fbcd1a29623118d8260b1208eba1
41d4ba0c-f4b6-4bdf-ad1c-a2c0437d0ae8,2276,3859,20250201,6,To really cell still total he.,2025-02-01,2025-02-01,53c0d07a3996151d928093b41bd1e710
c87007fe-2819-4bea-bd84-b7ac2941c287,1275,4310,20250128,4,Try cause force identify old network mention court whom choice.,2025-01-28,2025-01-28,0254e08de0652ea8fc1ad5afdb215f60
dcfb8656-aa44-41a2-aa5f-a4f255038552,2933,4965,20240619,10,Movie inside father less national.,2024-06-19,2024-06-19,69e32ed83b9c1d0c056a701d563b2f84
e28e26bd-6402-4365-9741-7a0a3f920d4c,4879,2435,20241209,1,Rate toward use wear happen force our sure.,2024-12-09,2024-12-09,f682e76287c8fd67720aa363ed287e85
5ce3e77c-b34a-4c34-b9c8-78a592a4a777,11,2236,20240922,2,Everybody collection step modern half body.,2024-09-22,2024-09-22,679552874d576da89671141769b77c15
882b852f-e04c-4418-8bae-af023421b0d8,320,4541,20241017,5,Baby resource around return get response.,2024-10-17,2024-10-17,6b899b2b6223e6298ac43272e8a53efb
8897cd93-e88c-4d1d-abd5-4e64b0a7175e,3706,4959,20250220,2,Seat example commercial wear east every early fill including travel.,2025-02-20,2025-02-20,6210e9f7ee056ebc244cfda13419dbff
6e162dc2-0000-448d-9ecc-75ac6532cb65,1870,3056,20241124,2,Safe owner defense fish past include response ground sense why difficult.,2024-11-24,2024-11-24,3ada4181d8f3cdf1ab8ceaf59ebfee04
649ad51b-4914-4d09-9e09-9d7c2abb4988,946,2018,20241014,6,Business manage office performance space end long summer.,2024-10-14,2024-10-14,0e84f59158b370374bc8c9a45fb7416e
38744a21-02f1-4ce2-8eb5-336f714ccb86,244,2576,20241011,4,Run fund wide low who organization ok common anyone candidate thousand.,2024-10-11,2024-10-11,a366447b6ed7ad67f4345707bf1fcb20
95ec7a23-d5de-485c-b2f6-d027e8d222d9,2611,3630,20250119,3,Heavy low computer include north million agree assume.,2025-01-19,2025-01-19,18fedd47465f88213c99bf3912528d16
765bca3a-e6cf-41af-b832-c1f612e303f7,1350,4347,20250427,10,Write relate individual leg unit listen.,2025-04-27,2025-04-27,ff0902a5ae319cf5ef45ea1e807ddd20
c18eb808-6a68-42e2-a309-571cefee55ff,1076,63,20241211,7,Democrat likely make degree will situation.,2024-12-11,2024-12-11,4a67525a9b85ffa84d2724a7b8984a8e
1233aa98-b427-4397-b12a-15f99713e9be,2370,964,20250316,6,Plan lot program because themselves training.,2025-03-16,2025-03-16,0bb8868740c7b339c6868d0084f4166f
7f4f337e-7aad-4cff-89c0-947f90b881a1,4009,4560,20240706,1,One begin major physical site early heart condition shoulder.,2024-07-06,2024-07-06,90083d4a74aebc279e340d5ead513ef7
f4bc966d-009d-489a-8a83-e144f215eecc,4906,3805,20240712,9,Music hundred also big book.,2024-07-12,2024-07-12,ba0c997519f2d1b605068b5c406d17c0
2ec0c5bc-42ad-4916-9b61-77639ee79607,1969,240,20240708,3,Station back poor wrong without lay vote.,2024-07-08,2024-07-08,2fa8ba1bd91cadfe0be11860e0a9c83f
f42242bf-d85d-42c5-82ec-3035d9329185,4428,141,20250412,2,Mr eight outside car plan language pick student relationship radio.,2025-04-12,2025-04-12,d6591aae10d47a40b942eb2c57e4d5a7
fa4a6d72-a38d-4358-a61a-1fe936a5e075,195,2459,20241109,2,Both century actually decade would let wind.,2024-11-09,2024-11-09,1a726e2a6c6c70259df565ee691471a4
d1ea483a-a6e8-4e3b-9d8a-c18148b948df,2357,2699,20250129,4,Will mission some be wonder likely majority method say six.,2025-01-29,2025-01-29,eb0749c2b02a4aaed4cc4ec9a68abd2f
3b81cd6c-7724-48dd-b94d-0e662cd70e15,2469,633,20250108,10,Maintain message decide expect past morning him.,2025-01-08,2025-01-08,666e6fc097f260e4450f42386122c2f2
c1faa6c0-a55b-4ce8-a2b2-4715ec680da5,2728,1035,20240902,9,Choice happen you rock firm responsibility tax happy hospital.,2024-09-02,2024-09-02,53eae5fe713a3b8af51152855add83e9
af35df72-ba4f-41ca-878e-3b65e75572db,784,2152,20250405,5,Would senior country military oil catch blue tough.,2025-04-05,2025-04-05,581651426227cca3407ea69ea50ac57b
b55dfdaa-b3d0-4740-a633-60693c44b719,3847,4553,20241223,7,Term region sport agent my when.,2024-12-23,2024-12-23,e9942d5f81a8e21523909ebac7a309fd
0c935d41-0ad6-462e-a279-aaea0f8d6959,3721,2358,20240619,3,Consumer cell modern alone eight beat thus past matter and hospital.,2024-06-19,2024-06-19,479f614eb9c058df741d0706e27cd601
5d986b92-9221-4be9-ac39-6b53ef9732e7,4511,299,20240613,3,Beautiful citizen half stuff report near his both.,2024-06-13,2024-06-13,a63f5e29afea2fedb16d66f94aea6739
b4dcb610-80b2-4451-a24d-c7444d2069d1,697,4178,20241116,9,Address light side attack scene.,2024-11-16,2024-11-16,6dce927add6e33c0535ced446290a164
6884263a-4947-4ee1-a86a-eee3b31ff32d,5000,1830,20250103,1,Tonight behind body both movement really white social paper response.,2025-01-03,2025-01-03,0eb65967810549a8aed12c0f092f3cf2
0dda8184-b8a8-49c3-a159-714792ba88b5,3159,1819,20240603,6,Positive may man evidence happen particular three his.,2024-06-03,2024-06-03,aaaa9853315c14117ba4d097bb2f8477
06ed1c3b-503f-46c1-9d69-c0abd9286768,4078,4582,20250210,1,Nature with section subject on those public natural modern Congress set.,2025-02-10,2025-02-10,4cc00794868df41fe0e2005b4d352eea
0e7bd137-b40d-4ac2-8f6f-e6cc9abf4c59,1863,3807,20240911,9,Traditional address could behind soldier still machine result.,2024-09-11,2024-09-11,4d9f4b1a5bf2298009987e1e8fb21d61
46e7dfc5-2af7-4c7f-bbd8-f4e993d98bd1,4794,946,20240811,3,Get season music law personal get.,2024-08-11,2024-08-11,ecc1ca5e61602be2269304276e9497bb
ef6ee323-96fb-455e-8032-1ec8d7d0ea03,798,1818,20240701,10,Result give dark industry only middle.,2024-07-01,2024-07-01,070b607b26b9d0fb806a486107c56d18
2be609be-c477-4637-84fb-b0105e5cf401,3643,2053,20241129,4,Through near public teach style recent.,2024-11-29,2024-11-29,ea2527e69af88e7c97abd8cb8dd847e3
5f81a1bf-e69d-4fae-95a5-b928a8faeca7,3298,4885,20250409,10,Administration language strategy although within phone.,2025-04-09,2025-04-09,dea967d9afa1a24d06e95bdf56a3f209
9d5fa68a-6369-4f95-b617-bf0be81cb92e,113,2613,20241020,6,Develop better scientist place line red marriage.,2024-10-20,2024-10-20,1af3922ee1707d4de64159415ef6d4b6
59bbf788-7e7b-4be8-b26b-721789ca9b5e,4527,2648,20241006,6,Explain daughter common teacher soon could program.,2024-10-06,2024-10-06,eba4f8faf16c3aa1280a25ece9f33551
9603978b-8e08-479c-b444-fe4d5c349891,4039,3049,20241121,10,Class course near each significant always off.,2024-11-21,2024-11-21,ed3e55a13756fda95893280399d7bd95
e5abfbe6-3b8e-43d5-8aa9-a13be37cd3ad,4688,2508,20250506,1,Must information fear already whether there catch total deep involve.,2025-05-06,2025-05-06,0b2061f59153e274a59d08998ba270da
348c5056-0eab-4722-927a-beee38936685,4463,2280,20250211,3,Scene paper same class even item.,2025-02-11,2025-02-11,229ae426a346ac6358330645e6cd807a
3be9acc9-a493-4cad-bee8-95d83e12ce75,4718,6,20241129,7,Happen help kid individual painting law.,2024-11-29,2024-11-29,bbb59b972cc906914254ca7d12fb5f64
ccc85099-7938-4296-897b-8d400eac3f0d,4938,3522,20240911,10,Prove spring drug allow board put attorney direction.,2024-09-11,2024-09-11,1a96b5f8c6ee9a8f1416ef0859e786f2
66ce3d47-0ab8-4698-815d-3f6e70568526,401,2442,20240525,6,American sea necessary onto out.,2024-05-25,2024-05-25,e7f949b1aacb79cd95648cd6c4e4370e
5f074ae1-d808-4531-962b-f633a37e4c86,1256,4259,20240623,10,Talk effect eight detail series.,2024-06-23,2024-06-23,f51f0edbd4d6354a023b8610f8e029f5
4bcbb396-5c21-4425-92a3-9b510be7378b,4451,3516,20250114,1,Economy production attack front hit cover.,2025-01-14,2025-01-14,90c21a2b4c40ace67dc3c4969072bce4
5e8e4977-828e-4c69-8fd5-2b94df2b5e2e,3091,547,20240928,1,Station heavy none kid sport least itself.,2024-09-28,2024-09-28,bb256a60c0cc5a08dedde02538a0a3df
e5a410b8-6642-4964-829b-4fe6c194f176,3183,2717,20250128,7,Building state nor style sit write far piece officer.,2025-01-28,2025-01-28,0261653c1fc2541308120dbf04e58570
f54cbd51-4790-4ff5-ae0b-80e921cda309,3766,1971,20240903,4,Author long where figure both.,2024-09-03,2024-09-03,e43a6bb54f7d22a5df35844c0bdb8ff4
949d3c53-6017-47c6-8f31-2c44e56004fb,3706,2240,20250509,6,Good charge news purpose cup network know glass pattern.,2025-05-09,2025-05-09,43a0a145bf651fc491ed40885312faee
c932f384-3fa2-4239-b0d8-119335da47b8,3638,355,20250207,2,Including western ground listen late less service cultural.,2025-02-07,2025-02-07,d0cc88210dea01e10e14d2ac88a1c043
bada9677-17c8-4065-894d-11595e0501ff,3270,2608,20240608,3,Season laugh data relationship chance firm it money later tell.,2024-06-08,2024-06-08,51de9db11b236582b6566158836d0ac9
33cdfdaf-a989-4622-a886-e191bdf77ffa,3639,3395,20240603,2,Fire sound simply ground while ask attorney.,2024-06-03,2024-06-03,f78dee0b22a530bcd74173f6e680bdd4
07c04c4c-dc53-4261-87a7-4d39fc11ecae,1825,3427,20250129,9,Shake certainly discussion real value training apply box clear machine.,2025-01-29,2025-01-29,8dfd20de6c55309ec9cebb4811251632
1a6d02d7-8f77-4aab-bdbd-bfe2a4f780d4,567,2449,20240613,10,Organization treat teach candidate recent kind charge car center yard either.,2024-06-13,2024-06-13,c2e3deb87764f1265d9eb3da2dd1cf70
69afcbf9-ef2d-4f62-a785-090d2a2f65f2,4521,480,20250319,3,Performance arm keep company certain room.,2025-03-19,2025-03-19,767d2bd955e50061098e341b1abce921
46afacdc-7391-4381-9202-b36680ce4e64,2931,1802,20240522,1,Sister degree activity about worry window.,2024-05-22,2024-05-22,b1e382d0e67482cee94bb480c72f539e
cc7fc13f-93fa-4a78-b466-1efa863289e8,4195,2297,20240806,4,Expect national year especially election art.,2024-08-06,2024-08-06,7e0683c89d1985b635eccbf36995f538
3ba9237b-24f1-4ea2-830e-ee7e760748e5,3924,3265,20240919,10,Cup story thank plan much.,2024-09-19,2024-09-19,1d317645daa5d50a80bef1a7c53b37bb
29e1bff6-62bb-46f6-8b13-b3de9d11449d,1317,3259,20240601,5,Front someone more animal life conference forget check.,2024-06-01,2024-06-01,48bed29aeaf57ef1a9956ce231b6256a
4cc0bec8-f777-49a3-a162-08dc272fbc40,2207,2469,20241220,8,Fill discover wear reduce million class current.,2024-12-20,2024-12-20,e9f192e8e13a9e992a1a0467024b0896
673f3307-1049-400c-94dd-7e0dd580b33b,4087,1478,20250331,6,Three glass trade cold that consumer.,2025-03-31,2025-03-31,6c5fd78ddc9a0d2c0168afbbe12ae46f
ac5191c8-a9a9-4d95-8e7b-fef1d914b906,75,4355,20250311,5,During site base indeed blue water.,2025-03-11,2025-03-11,b048a7b2f85773bda9f7cb17084292d0
eefcfa86-0e93-4bc3-a06e-5b2497a66cce,1509,1970,20250321,3,Commercial police go hit only amount miss camera.,2025-03-21,2025-03-21,e5f4ce91dc7c35df6bf47fcf74a71e7f
20857d50-217a-48ae-a65e-a7297a388cf3,2053,1427,20240614,4,Development soldier never few play.,2024-06-14,2024-06-14,0909b69de96b7474b8ba938651a5534b
613bce13-0d33-44ab-8c73-12d804b41b33,2470,4197,20240603,1,Approach start cold energy people across support.,2024-06-03,2024-06-03,db4eb3c2c33c19dd871d4097b8bca879
3ea5b334-3f69-4a91-9f76-0b0c0e7cc249,262,2244,20240531,2,Message clearly teach whatever yard they this.,2024-05-31,2024-05-31,2a7dadfbba66015a699f2394a39eff00
ab94506f-237d-43a6-9a51-6b466bb56cd2,3723,1033,20240806,5,Practice bag well something leg toward lay analysis.,2024-08-06,2024-08-06,6809c6a65e4b82d13770e635be9c5f28
1b7a990f-d7a5-41d9-a9e2-9169287fe7af,907,2712,20240805,6,Research fund kid pretty indicate shoulder Democrat sport teacher agree.,2024-08-05,2024-08-05,d5a4e8c33a1e1a4f7c1aa72bb00e9f4c
80dd178a-6c07-431f-ae2e-15f75477314b,2021,3264,20240725,10,Officer physical painting six just teacher carry see.,2024-07-25,2024-07-25,57d16413c5200413dac048dbc016f438
2543d693-d690-4e0c-af15-44bc21d91524,885,2684,20250417,9,Should and money administration each career billion year weight.,2025-04-17,2025-04-17,111eca3e91ef79d9ad1645e031180749
e95671a4-ba26-4109-8fb4-cf1e68ab830a,2770,2584,20240629,8,Impact car citizen soldier well month individual same little cover.,2024-06-29,2024-06-29,3656569ad9da7b50d497c95f42fe4ba2
d7c28c80-775e-4f91-942e-8f3b6130cea7,2309,4792,20240807,1,Be board outside red relate serve where.,2024-08-07,2024-08-07,1df68bdd3be53924dcfaf43b21cd87b7
128ad768-d9c9-4709-9010-7dbca41d341c,3148,1427,20250423,8,You Congress summer yes someone.,2025-04-23,2025-04-23,bcfc3132fe292af1ce9bf69325b56fc6
bda69e4d-5f38-4f36-b0bc-75a8de760d28,4613,3104,20240607,1,Professional benefit stop establish laugh sometimes.,2024-06-07,2024-06-07,a58816a96380a7d299cea96b70b9e6b8
61bea9ba-04f1-4ccb-ab3a-4e66af39a2a5,1329,2274,20241005,3,Stuff let avoid that teacher quite drug cup security.,2024-10-05,2024-10-05,f6165cfb1996b67fd7c6f8ac9339ced1
5c188621-6246-43f9-a8d6-692368e253b4,3023,3705,20240712,1,Watch laugh huge Congress.,2024-07-12,2024-07-12,47b4adcfacd657666c9d67bf9766e95b
250d2c74-9485-4ffc-88e8-9381eddc47d3,1960,1745,20250406,4,Defense history have various character focus produce base image.,2025-04-06,2025-04-06,192265afcd594c138bc49b6d79c54981
54dd06ab-21cf-4423-b469-d783a2fc47ea,1183,2769,20250104,10,Grow pressure smile per admit.,2025-01-04,2025-01-04,142018b956705f3319ebb94f284b31f6
457a46ae-dd36-487f-8ecc-2487a6de079b,2385,2940,20240515,3,Soon into life force movie plant Congress.,2024-05-15,2024-05-15,9d53c8438122a33659ba66386f1f523e
17cae7ca-af90-4fb2-a771-8ce919909b6b,1821,677,20241112,6,Detail lay particular smile sing various together.,2024-11-12,2024-11-12,ea036d207291b6f7050007483c703193
6700313a-00b9-4bd3-88a2-9c5fd309e76f,4406,1142,20250306,9,Audience get minute pattern couple food.,2025-03-06,2025-03-06,f357cab7a7d819c2ac273c2c66337e1b
625f7bf4-8627-445a-96e2-65453e9298a2,3170,1855,20240829,1,From identify fund those record pressure half far financial develop.,2024-08-29,2024-08-29,1337ef1fc28c4b51db4b2afd548ff9d3
4462068f-6dda-4749-aa1b-4ebe599d1b60,2290,166,20250317,3,Recently choice trip edge bill education order woman officer.,2025-03-17,2025-03-17,74afd734c4aad10053a385e43e82d27c
4ae13e45-4830-40d6-87cf-8bf10b3881c9,4957,3565,20250126,7,Bag research room the wife.,2025-01-26,2025-01-26,6b0b13e71bb033debc2baee6d452edb3
038a31c2-793b-45a3-aaaf-147063ba11dd,1506,4916,20250212,2,Cost both technology draw hair investment may laugh company.,2025-02-12,2025-02-12,0b1e1c4bdb5cfeb8372175fc6ec93a91
c50a1158-0518-4e98-9dcd-f2f8b96547ec,3626,1294,20241004,2,Parent letter cold no charge show message however rate.,2024-10-04,2024-10-04,3047f7229ffee09c171f208dbe900ba5
d3032830-e621-48ed-a8e8-f05eba06b6b7,3977,2421,20250117,3,Pull ok affect avoid score today different modern.,2025-01-17,2025-01-17,e4f5101edda248113349e6711256f081
99a84a92-bd63-4d67-8a60-9f78df8d3628,4918,1138,20240516,3,Conference when none time place.,2024-05-16,2024-05-16,b9ca78c384f15325f20b34f833dd0357
540af3e8-e573-4f14-b24f-3892f6e9bed3,217,2475,20240831,2,Security current college knowledge store some future office.,2024-08-31,2024-08-31,31d4df843fffbe2307ef33b5da145921
a752043b-5d4c-4347-91c3-25b42027e603,3337,3802,20250207,9,Some see another cut son city.,2025-02-07,2025-02-07,6504f9149bc5aecef764e4a558efbc90
