SatisfactionID,CustomerID,OrderID,DateID,SatisfactionScore,Comments,DateCreated,DateModified,RowHash
2775eed2-9dfc-4e41-a360-c3950a2136a1,1754,2573,20240622,3,Throughout result store across week point southern concern.,2024-06-22,2024-06-22,ba90afb92af29d2e39b8606454595c3a
8518ec66-b9d0-41b9-ae63-6c7740c7f987,1948,1185,20241130,9,Ground foot concern language investment worry.,2024-11-30,2024-11-30,279ed3db428457e15d412a55473b0cca
cdb1ec08-9ffe-40c6-9131-6ff5c60830c7,3005,3055,20241127,6,Sing notice speak I along page response population not.,2024-11-27,2024-11-27,d0e2f87b4ee8b02318914bfb1004d940
af2bdf9d-4b0f-465b-affd-b5c7a2905983,4528,145,20241119,10,May certain some suddenly investment get.,2024-11-19,2024-11-19,d5a7f2e264a232b90f568fec133713c5
bb32b5b3-7b6e-4a7f-8e1e-ded641bb0d3a,2819,3982,20250124,10,Reflect paper certain arrive news western hold stage.,2025-01-24,2025-01-24,719d927509fc822e95cd2f1730c1bf25
3afcaabc-0cb9-42e2-9eda-f3c6e8b1cac8,2470,3997,20241008,6,Action market cause star policy commercial media while myself sing.,2024-10-08,2024-10-08,6eb15c49e7d9f6060a9fa830cc866d76
1bf52239-2b26-4a7f-8acb-000bd7d2ce72,4109,801,20241129,7,Bank generation big hot space production next important.,2024-11-29,2024-11-29,eb66057791572b09fb7d0555cbd112ac
9950cdf4-5985-4dbe-8825-f8d47be069f2,3297,363,20250102,3,She to test crime economic.,2025-01-02,2025-01-02,b00dc31efb8c5aa0fd6d8fe2b1daa578
48f28ce9-7e3d-4911-a4f4-ee85d2cf2b97,4350,2151,20240520,2,But east fight mind could analysis investment.,2024-05-20,2024-05-20,d189cccf8db5faa773ef2a05d8de142a
64b4a167-2ad5-4d16-88ef-7982d6a2030e,1585,3364,20250312,3,Wind ok prevent argue store woman fund coach partner tend.,2025-03-12,2025-03-12,b34ebe73178f0fdafdf38167d3a33d3a
c15bd407-5ba7-4f72-87d5-e41d31c1ed37,1953,1749,20241101,5,These expect assume black us theory production.,2024-11-01,2024-11-01,b0df2f8c490833648acb1a90e69e31a1
820ec7c1-944c-4a6a-85f8-e8de155e8139,3638,16,20250308,5,Quite animal live ask feel small series approach.,2025-03-08,2025-03-08,4d2df54677902dbf4b44b3217ed5bc8d
eb738e43-2910-4055-998e-86136d7c1cf1,150,3810,20250213,2,Individual lay back need source challenge relationship.,2025-02-13,2025-02-13,0d69fcf5d3c65dc81dc14d0b63c4d360
9b8258a3-4989-4509-9ebb-03174aae11b5,2062,3281,20241204,10,Daughter forward level shoulder structure term create.,2024-12-04,2024-12-04,28c8f58caab062b3105af3e51ec6897e
7af6513a-0ade-4be0-bb59-7961d0bec903,3643,787,20241006,5,Body information our may about special population statement.,2024-10-06,2024-10-06,2d247b7c6fb2632c46dd5afe880457a2
5f18184b-247c-471a-9eb1-54fc51578977,4037,4833,20240904,8,Dinner push truth hear page.,2024-09-04,2024-09-04,1b119b27a90e4bc749a2d11fd85a762c
dae0f97e-2050-47b7-9e92-cd5445e18e0b,2012,2383,20240917,2,Condition gun actually purpose miss enjoy cause.,2024-09-17,2024-09-17,28043cf1c63e182bbbaf7fe38c93a89d
a7001a1d-bf90-4556-9a46-88f580f8e497,4555,2862,20250320,6,Cell only hold career fear option every special lead.,2025-03-20,2025-03-20,a9314c6a12f5418e4bfa0bf0148a94a5
9a4ec88f-754f-4368-bd62-df3c9d563d8f,4686,2786,20241004,1,Contain pattern indicate campaign include for trip arrive seek central cell.,2024-10-04,2024-10-04,ce73db88386d7a4daac8a1ac8cdc3e2d
fa0ed4fb-e559-4856-b4c0-bd7de70b4919,4246,1776,20250424,8,Arm activity nearly entire likely another.,2025-04-24,2025-04-24,2fef77d60ff30eb7e84dbf78da2c21ba
830deb6f-3c47-4c63-9e68-ea2d0d67bf1e,2322,3055,20250404,7,Behavior sort direction bed arm stop employee.,2025-04-04,2025-04-04,ee8cec49667e22f8dc0f80eef9582126
60914db9-d5b6-41a9-b72a-eaeeace84dda,304,1005,20250219,8,Analysis customer large determine front indeed skin to your they.,2025-02-19,2025-02-19,dc0afb2fe6bc6606e8e19ea4b041d2bf
77b01eb5-a527-4c14-b9e7-af8165a17276,209,1565,20240611,10,Civil deep there each lawyer newspaper drug.,2024-06-11,2024-06-11,25a664510ad3b81334e493794c94a675
64892d9f-d57b-45ec-83e8-213501f0a2bf,3181,826,20241211,1,Along weight score local these writer check.,2024-12-11,2024-12-11,bba4e686c99b876e76471ac2eb41d3fc
59b5d1cd-d0c9-4644-869e-9c09b79f5a5b,638,3770,20241025,6,Risk main key environmental everybody campaign miss else movement.,2024-10-25,2024-10-25,2994d24c6111169888a1468019983f72
854123c4-da50-4c03-be94-1eea410e280d,256,323,20240613,2,Ever interview contain rather radio result son.,2024-06-13,2024-06-13,952f1448e75a22b4b82d88e0fd5bac11
f00366e8-491f-4472-a089-91d989f5b0d9,3591,289,20240602,7,Teacher bank state activity man evidence other.,2024-06-02,2024-06-02,1877fae4845e4dac32c1ed22bea35d67
0ce9013e-ec70-4e4a-9791-ce4f16ae7ca4,3769,4693,20240514,5,Pm go hear wonder.,2024-05-14,2024-05-14,609c2909c88e1230161f03b04e184c67
9ee97ba4-bab5-401e-95ad-8b0721e6b880,4708,274,20250304,8,Notice give low than author Democrat join believe behind.,2025-03-04,2025-03-04,c6eef31eef728f2839857d5017c01e97
4f58b467-6890-47aa-a78e-757066b9a47a,4449,3543,20240629,10,Ahead picture school different color.,2024-06-29,2024-06-29,f17718396520c1fe7471ac76ba3ea202
9142e9e6-cb79-44dc-bd65-ee067f79c24f,1459,4334,20241106,6,Third realize soldier police various feeling.,2024-11-06,2024-11-06,df17844fee51e3f6b50a2d31febae7de
e4a498d0-38a7-43c8-b4b6-4a4a24fe5b65,2571,802,20250313,7,State opportunity financial energy nice north job.,2025-03-13,2025-03-13,bdefd01b9784060111e3a70f040173c3
083dc033-5991-42f5-af10-d5b4d1054a37,1279,900,20250107,6,Fire certainly system quality about energy modern.,2025-01-07,2025-01-07,64386c56106007b9fdf8f9562761fa13
89f098f7-6d0a-4ae7-9d7d-b73269767cba,4738,1937,20241104,9,Test goal rate than sense recent middle rather issue.,2024-11-04,2024-11-04,e544326a3d7511008dcb7be988de202d
cffd0923-52e7-4e23-b670-c9b5ed714d8e,4796,3476,20250216,8,Indeed kitchen always wait woman life threat sea back beautiful.,2025-02-16,2025-02-16,f37b33eda55a418936caff4a3f95c32d
25630c75-8b40-4f5a-9dc1-2b7d42ff2c1f,3292,2048,20241102,6,Since either moment firm seem teacher.,2024-11-02,2024-11-02,3ad3cc634893c95bb5964bea482fc067
87571b80-a820-483d-b52a-3a753c71eeb6,1622,3510,20241019,8,Send black draw management forward industry most issue person.,2024-10-19,2024-10-19,dfc6c3494f5da6b4cd101a93b34e5369
22c1912b-b587-405b-8e09-47728500ae48,1968,3015,20240912,6,Type risk husband receive decide new throughout rest game second.,2024-09-12,2024-09-12,75fda5c68ff8563d5301ca66ded9a0bc
a10a2fe0-b90b-414c-9a59-dcdc98881d97,4319,4869,20240621,7,Laugh hundred every growth newspaper apply beautiful series television sure.,2024-06-21,2024-06-21,178bcb5f812d10eaa2d9dfeacc88a0dc
3d8a8d16-645c-4923-af8f-5c25361769de,373,4007,20240603,1,Exactly leg approach trouble everyone check on production.,2024-06-03,2024-06-03,bddcfdd665241bab4030b3a57f90cf9f
b1f56b96-21dd-4fc3-8105-5ef7569a91ec,3723,1050,20250211,3,Here these growth attention statement official lay fish.,2025-02-11,2025-02-11,1412888e256fd44339b4a4b9358b32b6
0f102f80-e94c-40f8-a586-bda735f8a496,4375,4411,20250314,4,Scientist we kitchen lot history trial item various game authority.,2025-03-14,2025-03-14,f70fb1ccb720da2b9bba6813664dbbed
7869770c-2b90-4c18-8dca-3f9b7d1ea95f,2213,700,20250202,4,This shoulder all discussion.,2025-02-02,2025-02-02,0d0df72fb4c773b52fc055e01cebe7d3
a71529f5-d032-4b82-a32c-c5e3f16779c3,1889,2830,20241110,2,Live its happy know doctor home everybody participant under.,2024-11-10,2024-11-10,316cac8f52f134d1c5f87a0e652f4064
58285314-20bd-4115-8e01-fab8db0ef7cd,1589,60,20240719,2,Interesting special owner risk much ball father.,2024-07-19,2024-07-19,7e872eb7c295ac147532a404450866c7
e6cf934f-e7f0-4e5c-831c-75bc3059fc33,2230,1553,20240606,1,Section garden own reduce worker control.,2024-06-06,2024-06-06,345f197e014d14a14438121d9ef905e4
31b7795a-1d4c-420b-8d93-3759a7c74c5e,4945,3835,20250316,5,Attack sort strategy those security their southern.,2025-03-16,2025-03-16,aeca7ec4f72977e1b5b07d3113d03521
dd7acf33-6949-4fb3-a5a4-bc85265bb01d,1352,4035,20250406,5,Him court best no line threat drug billion.,2025-04-06,2025-04-06,d7301f1fa51cdb93826935e55a551e58
bb9dbac5-b404-4083-944d-7da9f9d26bfd,1858,3541,20240818,7,Increase throughout attention foreign admit model film look tax operation.,2024-08-18,2024-08-18,9f60a62dadd68bdc111ef8bf4c3b9bfe
72f0b807-b2ae-411c-916b-06c73abe5b3a,1844,2570,20240522,8,Scene arrive standard painting else safe.,2024-05-22,2024-05-22,9ad897adf62fe89405e039a3ae83a015
1fa2a589-ec0d-4164-806d-03f04354ac06,4652,3392,20241019,8,Idea everybody figure exist author college you.,2024-10-19,2024-10-19,33c6f7a0982472a72927075e7fbb7d42
92a6cccd-99b1-4558-b462-475524977352,513,2196,20240913,9,Read describe amount letter resource feeling bar.,2024-09-13,2024-09-13,56de9ee3b1b2b15394474c0c5cc0c33c
c59ccd92-1d02-4d5f-bca4-569ebdbc37e4,184,1606,20240906,1,Plant service leave only since then human enter clearly.,2024-09-06,2024-09-06,7508b6518cf42aa9264b935a7e83b7a2
8deabc5b-bf43-47c4-800e-ae65c5842cfe,423,3738,20240803,4,Type bar away I even address collection land race.,2024-08-03,2024-08-03,bc09cbb63296f2b718572cf788798d17
bc712131-3891-45de-84cc-2cdb3ba74d0f,2984,3580,20240819,6,Effort young professional hold better.,2024-08-19,2024-08-19,2f9c518c5baf571337308dba0435eac7
45630ddd-29d3-4a1c-8d93-90eb9ac7cf66,4594,1257,20241031,7,Environment last resource so stuff water.,2024-10-31,2024-10-31,9b84220dc285ec6ae5c91aee5eb177de
2c093a53-89c8-4521-be53-759870e44f78,207,4208,20250105,3,Eight individual dream ever here successful.,2025-01-05,2025-01-05,71c2ccfe7e156e4ba3d5c0c8082416b8
21425a85-fffb-40c6-a243-c9cda3ff971d,2808,1487,20250330,7,Economy alone able rich any official.,2025-03-30,2025-03-30,40be12e41c8414f50f3dbce08e60045c
6ef47ff6-fee1-4035-9313-972ac096a438,1944,3858,20241224,10,Group final modern yourself someone compare live wear.,2024-12-24,2024-12-24,f63f0bbb09e1d4f5dc17a1dfc9ffe95d
236e720c-02ff-49d8-ad73-7770a2da8a72,2167,560,20250202,3,Audience century occur exist education close authority.,2025-02-02,2025-02-02,a08fde560482bbc1c8ee4df4668bb5db
4297fa9b-aed3-45ec-b41d-d6d91b6973aa,4150,4286,20240817,7,Plant pretty interesting art scene somebody suffer financial.,2024-08-17,2024-08-17,3acecd6c9182cbace994f90f8595e6fe
20005da5-810b-4211-809a-113837dfe800,3516,4779,20241013,2,Agency sure his dark view push.,2024-10-13,2024-10-13,81a0bdbb3dc06e10d4359dfb1c69fa61
9d091c6e-5b3a-441f-a7cd-c94f27921b6a,725,1035,20250417,3,Herself need tell benefit summer education outside include toward political.,2025-04-17,2025-04-17,64a6662186928adfbdcc917efbef991b
b6a9fd58-2270-41cf-a61d-24658799d7b8,1607,1362,20240526,2,What style hope Mr.,2024-05-26,2024-05-26,f955aa7d2942316040bbf670f39f53f2
d65cb762-4d03-4592-b32c-1cb861747518,2162,1364,20250127,6,Ahead at tree cut.,2025-01-27,2025-01-27,ccfe9d63d3cddf9a01233b288fd9a1fe
189997a2-fdd0-4b01-b545-6ca718a038a0,1304,3094,20240724,2,Simple add group from beautiful represent positive.,2024-07-24,2024-07-24,ca10e7ef3353e95503402a964773b1a8
cdaf2bd6-8ae7-444f-b840-936913ff5960,887,4798,20240611,8,Speech decision third would TV vote prove fill age war.,2024-06-11,2024-06-11,2ac022e9450b4254dc28feb7c00b0596
98670e34-6c8c-4974-8cd1-8e95f86c5cc3,4478,4650,20250320,3,College north foreign health notice foreign owner must.,2025-03-20,2025-03-20,a0ed78c409445092034a037d04d8c141
68b0fa4f-ae7f-477c-80a0-2a10666a24c8,2730,2508,20241217,7,Win trial industry political across environment front himself.,2024-12-17,2024-12-17,38b96bb7503cc0afdabb7c1affd007f5
374eac19-798a-40d4-bba8-81f064e11404,2609,3699,20240805,5,Officer structure any game side.,2024-08-05,2024-08-05,31817d4fcbf9d5d957febcc758154cef
407df2d5-b719-43e3-b31b-b317b2e9a8db,2236,3093,20241223,6,Image production environment set draw.,2024-12-23,2024-12-23,a2f27a13cb1f58c244f9ff7c32b61dbb
8ca7e909-f84f-449a-b9fc-0c5dc77a21c7,1760,1482,20241220,6,One project through single scientist lose.,2024-12-20,2024-12-20,53d10fb89b6f302c9d944e3c2a7b0e5a
13e5948c-74a1-4bfc-ad0b-07ff9240abb1,2598,2296,20250419,5,Individual attorney recently budget feel claim why sometimes same.,2025-04-19,2025-04-19,f4abd48eb3fa860e085dcc3103303fe8
72764a04-6cbf-4fc4-b14c-5a939122a8ca,626,897,20250120,9,Brother agency protect clearly lose identify.,2025-01-20,2025-01-20,fa6267ad56c8241ee4900a59aa793f05
c4de3f56-a9e5-468e-a73e-33918d8a9fdb,800,4361,20241024,6,Off society leg authority eye east Republican.,2024-10-24,2024-10-24,8e269bedd3569da733c2ee5d94232f7f
943a6d26-c74e-44be-8d5b-e3138b21cb4d,700,1752,20240605,7,Remember young measure recent material.,2024-06-05,2024-06-05,78cc4cbc5cf305ce67d5def6a6052a12
3441a9e6-0b5b-4bbb-a89d-2ece0594567c,3688,1537,20241231,9,Customer long represent Republican ball think.,2024-12-31,2024-12-31,4955e5602495e8080615bfada657f475
f3d85871-3006-4baa-813b-71f0f1f277d9,150,2770,20240618,3,Key success million can them must structure.,2024-06-18,2024-06-18,00a937d096bcd854bd535fd3199523e9
87a83c6f-7ef3-46e4-8333-23d4bf4a58ec,475,1689,20250317,9,Everything human successful pattern interview even government board box.,2025-03-17,2025-03-17,e96559c212e29d5e04a4c35d83513891
3e358fe3-9eef-45dd-ae55-95933f334f9c,4423,822,20240608,10,Beat big fact method per reason truth occur.,2024-06-08,2024-06-08,c0002f0f4efb042299e33ab8b626e66a
a37fde26-319f-4bc3-a4e1-2c1fe03e8264,1773,3642,20240917,7,Enough conference usually rule break.,2024-09-17,2024-09-17,26e1df4003b053f67b8c8c42d351a5e6
110b1023-9316-4052-b231-32bd19edbecc,4203,2466,20250217,2,While manage treat box never woman organization court system however hard.,2025-02-17,2025-02-17,a1968a0023841c0ef2d5b350308ed508
f68b7335-67cb-4c08-9f78-28bcf103c217,4400,2290,20240701,8,Me easy knowledge serve rise final believe event.,2024-07-01,2024-07-01,00dc36d9db4da99075d62f58ff623bac
024de53e-5eeb-49bc-8274-7bf61fe47829,658,2132,20240723,7,Institution effect effort training now class piece hundred.,2024-07-23,2024-07-23,73ffa6e8df3ed32abada28aabe110542
a6436f74-b992-49ce-935d-44f878c884f3,1103,1359,20250511,1,Physical another off leader scene of economic.,2025-05-11,2025-05-11,cbe1c9135c21334a133ea6b81be3b7f1
431008da-89e0-4ea9-8fb7-316d024d2e0d,611,2139,20241230,9,Keep president call spring close role modern.,2024-12-30,2024-12-30,9f15bc8be912ff604ac5818610134126
9f59061a-6aa4-4a7c-9f03-562191ca3e39,1998,1625,20250213,4,Local believe quality store dinner.,2025-02-13,2025-02-13,8092444dba2d2d6a7d2a5a8111dced23
c20ce4e7-7f7d-4831-ba85-4ac356641e73,2652,2187,20240905,1,Nothing morning avoid mention choice true.,2024-09-05,2024-09-05,6029b28f97aca794549057978eaaf312
1d3e256a-7265-4cb2-b806-7800a7aa4001,799,912,20250330,3,Few notice plant break paper life.,2025-03-30,2025-03-30,f07ed21a27f1adaaf69a719c43c0c256
9b19b0d2-a2ae-410a-80e7-fcce7002ecc1,3629,1385,20240722,9,Environmental next reason political could born.,2024-07-22,2024-07-22,6a4b388855cd04b9ee8ef401cf1edee5
d556c41c-0af9-4653-8eda-e9cbe8b79298,1697,3189,20240612,1,Option star us occur hotel organization ground vote.,2024-06-12,2024-06-12,c08fe6df038fc988f093297d513b7dce
0d866307-1c11-4c20-84af-fad6f2944914,1603,14,20241225,9,Mention kind second if major military standard again other kind gas.,2024-12-25,2024-12-25,acec6637774ff548b441caeff3bd49c9
38e28730-5c1d-47c3-a3e7-afe3a25ef741,3946,3235,20250308,5,Upon assume seem when wonder particularly none respond significant less.,2025-03-08,2025-03-08,447000e32fe8d1695b1ed3d7e69ed735
cc6dcb35-57d4-4656-b6a8-92fc46da4d46,3840,3956,20240811,1,Security deep name page five might raise write either.,2024-08-11,2024-08-11,79cfb9bb10e296f9b1bc5f2504365086
10bbbec8-17aa-4c7f-9bdd-b238b6df24b6,4695,87,20240912,7,Father manage record same turn letter before fine suddenly official.,2024-09-12,2024-09-12,cc7559cd622e055f3e927e85a9314e86
12d6f3cb-3ee0-4490-9f5d-907061420ad0,3959,3568,20250328,2,Early hit house her from movement look senior technology your.,2025-03-28,2025-03-28,4d0fcb806915479616d78e6d9d68c56c
6e485641-edb9-4967-a829-267cabf8a0df,4453,1944,20241012,8,Hear home standard member house right entire good mother senior.,2024-10-12,2024-10-12,54e60d1451977e74e1f4617bdc9c0305
44ad64bc-15ab-4816-9c3d-26da50d8832f,3091,1183,20250103,10,Particular son surface life school.,2025-01-03,2025-01-03,f788c70bc0a5c3441f6813dc4de217c9
bc8da66d-bdca-492f-bbcc-53f7fa9c9fc2,3058,22,20240905,8,Some decade charge deep sense on expect be production.,2024-09-05,2024-09-05,122ec1ec7e045261885ce39abceea039
5fa2d95e-7d54-4094-9e7d-9e8385d5ece2,3450,3955,20250224,2,Then player fill all answer office rather research.,2025-02-24,2025-02-24,6de33808a1ae3689f170ce70008d4eb2
047c4d6e-45ad-463a-9740-e28b85f9fb9f,3409,1520,20250119,2,Kitchen parent provide actually standard represent light.,2025-01-19,2025-01-19,b274aae043dfa3af98c556aee930ffa1
a4043fd2-f2a3-415b-8833-a27262f34f9d,4088,1207,20250204,1,Seek even customer maybe get total again condition north.,2025-02-04,2025-02-04,c055a3daaabec539a2cf646014a548b3
25b75274-10b4-4576-a3fe-6981a7342bc0,2310,4470,20241125,9,Young over foreign full almost.,2024-11-25,2024-11-25,685fda80271ed8dc766f95a7ed9021f9
07be3496-9fb7-49b6-b321-74482bdd8ab7,4229,3234,20240718,9,Radio still mention bar society.,2024-07-18,2024-07-18,f0b0bdb63dc4a310776ab6941aed820f
92cd70b5-2972-4309-adfb-39fc3492dde0,405,2456,20240726,2,Man choice mission leg people possible medical drug.,2024-07-26,2024-07-26,825547beb6f8c90b408618c675060f0c
7a0edc5f-66d1-4e58-8e6e-2136cedd5366,4105,3195,20240611,10,Field provide out different painting somebody car house business.,2024-06-11,2024-06-11,9cb7c6a0a480f0bfdfa21b740a5391d6
ef7c45c6-9d3e-4937-9992-4d5764730f4a,1822,367,20250413,4,Officer mind military white claim career professor practice team mouth.,2025-04-13,2025-04-13,4bd272dfa26a0493edc176513876c076
3f063595-71f9-417a-9506-ae5a94e81c64,1326,3172,20240606,5,Mr area send long grow.,2024-06-06,2024-06-06,b5a74c9076187c9b89ac4135b60412b0
12e6a64f-91a6-482b-a75b-e2b4ae65ccc8,2692,3282,20250425,5,Tell where stage cold line organization animal drug cold.,2025-04-25,2025-04-25,a2f2b82a172747809eec7712f0facd3b
efce5a01-74c2-4757-8204-72b72b1aa948,3518,3828,20250420,5,Ever director traditional wrong lay society miss.,2025-04-20,2025-04-20,7ee0ce5e48ecb36a1c736ce9b96e1784
511a46db-a64c-4e9e-9b96-b85d9d265c83,895,4824,20240926,10,Effort set campaign high simple magazine leader language adult.,2024-09-26,2024-09-26,28a96166283a970d09427581dfcbdebb
62af064f-598e-497c-a901-0c8d5ca604c9,683,3288,20240702,1,Turn and bill growth message last.,2024-07-02,2024-07-02,7761ac3638b160b975ea47bf65a2acdf
8f9f76c9-6c80-458a-9895-8931edc2fc27,2646,1890,20241002,10,Wish market statement painting card already travel style.,2024-10-02,2024-10-02,6298aae91fb6a597fc47d2e50bcab8ff
ea16f57c-8b7f-4e6d-9fb5-44ddc1dbbd32,168,3170,20240607,5,Wear level member nearly think edge eight threat computer.,2024-06-07,2024-06-07,a098bd930fb4c172e19ec5386b37ce8d
53060d79-2171-4d3b-b500-092b11862c8e,4663,272,20240626,10,Whom at argue traditional machine drug stage beyond read operation.,2024-06-26,2024-06-26,2a601c4e306ebc77d1dfa2f839de785b
ae331d5b-8f52-4531-8b5a-79ad5ccb438f,3986,127,20250428,4,Glass whole indeed moment compare standard lose environment general.,2025-04-28,2025-04-28,f5b356b315d7b8ce7d89e88b35c39f49
f59288b0-07ad-4d01-960b-255d0342a8a7,2445,1071,20250503,6,Operation night large information term military success free leg.,2025-05-03,2025-05-03,d1c1a774deae785de8abf5986aba2e4f
83b1948d-873a-442b-960b-dc6d50c0edb1,938,4884,20250211,8,Car together court senior former particularly.,2025-02-11,2025-02-11,df0094a9b244672f17336f2c390233d1
ec9076ca-a319-463e-88b1-b2c4c49b908e,435,1011,20241210,9,Marriage grow international issue arm speech dark kitchen purpose wind.,2024-12-10,2024-12-10,c5976d3ed135958fd1323254463700f4
4a820a7d-a178-429c-860e-173645b8dcf2,567,3062,20250318,9,Each career just nature mention bank nice.,2025-03-18,2025-03-18,81f03467ba097d4e23789d35bc558435
1865b82a-65e5-45a6-9f3c-1a694f81cd10,4702,818,20241123,4,Trip article film financial plan always risk tough crime.,2024-11-23,2024-11-23,748e303b517006c7e531d966fef71106
1d21a4c7-309d-4f5e-8cb2-61e50be60d9e,3254,4464,20241121,3,Story give hot walk firm if rock.,2024-11-21,2024-11-21,c40eafc4f75244a038dcc21c7e46140f
328907f2-6a8f-4c45-bcf3-dc45cdec380e,4748,3206,20250209,8,Program question myself off girl floor they sense.,2025-02-09,2025-02-09,9609e76916c1d6c89b10a1573b007bbf
08556110-d0b3-47a0-8168-15730e200c39,89,3788,20241017,5,Social high improve age according why these decision.,2024-10-17,2024-10-17,8413d3d94743e7c02da9162703aaba8b
e924bf7b-0351-48e7-a498-350d770a48a9,1435,966,20240814,6,Finally show analysis whom piece send its whom party.,2024-08-14,2024-08-14,90a8784dc326d29531db528b94c17a12
b67d6d7a-bd8d-40e7-ab34-6bb01dd9fbaa,2021,549,20240823,10,Ever story recognize area west director east country product term.,2024-08-23,2024-08-23,3dbde0a49896b5c7c0365bf5f48f3036
dada097c-7dab-4a92-b0d8-cb740697aa74,2040,3261,20240824,3,Necessary today commercial month food keep.,2024-08-24,2024-08-24,4bcb7b4c06f837c06638235163b57ac2
181f6eb9-aead-4c0a-863b-3e85415567e1,2793,1408,20241119,7,Investment huge former military education onto by bar.,2024-11-19,2024-11-19,eef17d8055681827ee4424514766ab8d
ba2bab50-56ab-4a95-a6e5-f1869b095ced,29,1152,20240915,3,Star stop its help road ground eight.,2024-09-15,2024-09-15,f4c4b4a0e1139e8e1e9f9f2f35ea84a6
74241944-b3e1-4d76-bf1d-9ab07e37a8f7,927,3469,20241101,10,They before animal politics officer character practice her his go.,2024-11-01,2024-11-01,13a594bf812eda55741b3eafd2c3967f
d2d99880-8bdb-40d0-bd74-738199dc6be2,206,4509,20240704,9,Plan identify effect international smile former.,2024-07-04,2024-07-04,d9311410541b902a0997d3051c3f0fac
acee54a2-2532-4f8f-984b-5b6a9ddb5b07,3732,3006,20250509,5,Quite light catch worry talk report candidate hotel throughout up.,2025-05-09,2025-05-09,2fd9b757a9832a0b5fe7c4d31c38f2f6
085026bd-c758-4a25-a77b-73a04e2638e7,4214,86,20240511,3,Skin style able official bit seek little plant.,2024-05-11,2024-05-11,814f984491fe609d1a02be6496e8580e
01861a78-8445-4a7a-b963-a5f64f5269bf,4944,1900,20241016,4,Personal federal natural different cause same quickly member.,2024-10-16,2024-10-16,8c8426671465043cb53c12c8a465c449
ca0e1a4f-6e7c-4a9f-babf-dae500d79d11,3016,4467,20240926,4,Class science deep behind notice still quite team sure.,2024-09-26,2024-09-26,6a91e8e688cb29ed0cc4260cd5d6363b
8d3136be-2368-4893-a972-a3512441471d,4125,2442,20250224,4,Able good spring page sing suddenly compare daughter.,2025-02-24,2025-02-24,e22eea1982cde8a764342ed8ff235801
851d1119-4f3c-49d0-9ee4-94159bdbba41,678,35,20250213,7,Assume bad exist truth instead.,2025-02-13,2025-02-13,6d1674771af4d5a2f138ff158d7c1b55
c3a1e3c7-ae21-4d53-9a80-12136796f3cd,2967,3676,20250219,4,Be movie type with network treat that meet.,2025-02-19,2025-02-19,8aad0601d8a6db6cc2561dce0b0a6968
3567c058-327a-4622-bcb3-34f2af66e890,2673,692,20240607,8,Traditional local find responsibility doctor live part crime step sit.,2024-06-07,2024-06-07,fd2a919ce6022db667051f207f07e4ef
931003c0-3f44-4e84-bbf0-153649a4befd,2552,2770,20240923,5,Personal law apply idea ahead less.,2024-09-23,2024-09-23,fb213e11d6d6b7a62a8ebc0e1158071e
af5b7dcf-025b-4e1b-9136-41af8ccef18b,3092,4702,20240708,4,Dream month daughter old little individual performance behind book.,2024-07-08,2024-07-08,6ffa24405407bc3d33a5876b34970ace
f73334e0-b47d-4e5a-8c9f-3ae51f229985,2828,1001,20250417,1,Behind shoulder east high represent painting everybody.,2025-04-17,2025-04-17,fbde1ab1b996ef5f1115332bc9a07272
a5511d95-601c-4eb3-b385-f9781d753b56,1335,668,20250306,5,Teacher meeting dog work instead thus.,2025-03-06,2025-03-06,33b15fbc3c318be91640622441f6b498
954bfe38-edd7-4fba-b1b6-6a7ddae5a1d2,386,725,20240926,3,Light itself eight newspaper Republican become draw.,2024-09-26,2024-09-26,88e2cb8633c5f579c2ccc5a1365f5d84
64df207d-a3be-4268-aaaa-89dff9133bf6,4449,2004,20240905,4,Guess movement bag include market figure.,2024-09-05,2024-09-05,b3ce95e420e7f8e13c8d6e0ee390967e
7882f31b-df04-46bc-89b3-eb181f84e6a3,711,4681,20240630,6,Rich happen benefit one stage later.,2024-06-30,2024-06-30,52a1f66c5a5b897320f29d366a59f78c
61f99a30-807e-45e7-9aec-0d82da38338e,3012,4205,20241017,10,Free research chair important kind board environmental establish doctor.,2024-10-17,2024-10-17,a03743c25b731679945a4553b2bef35b
2abddcbb-c84b-4468-bef8-b3d84197a5d9,3951,4639,20241124,10,Teacher chair resource sea near production thousand speech.,2024-11-24,2024-11-24,f1847a2f2cca14c5c82fd405dc7f81fc
5a33f62a-f086-416f-b1ee-7d874c519bfc,98,1807,20241116,6,Either question cover north off real church pretty middle.,2024-11-16,2024-11-16,e80bff97cd2ae106fd440356718dd8d1
5224ed22-38f5-446e-9c33-ebb7a1c2809e,4939,3718,20240606,2,Career could indicate on response.,2024-06-06,2024-06-06,d3af5780570080500f9edc0da40555e3
5afd9436-4b6f-4649-89ba-d6976e0c3521,4037,4039,20241208,2,Media law major role star dark.,2024-12-08,2024-12-08,590e70efca3ec5270acbea8c630c6aef
c0c3bc4c-8b9d-4574-b31f-a711831e9e80,3981,220,20240806,4,They discover wife election during official garden thus.,2024-08-06,2024-08-06,1410abf3d9a85b3d6cd4af870a305d69
91adde9a-2b58-44a6-9790-e7e1d190c9b0,268,2830,20250325,7,Them kid success where difficult we.,2025-03-25,2025-03-25,8972a9435956b9ec3150c3f41ad69786
f1193bd2-9c86-4bae-ab3f-85b010801e04,4099,3702,20250416,1,Leg bit me measure though.,2025-04-16,2025-04-16,625499b9d8864d0d38e74e89c215a910
1e1e018f-17f5-4746-9031-3b9e5088ff1b,4696,2486,20241011,2,Draw talk month hot factor public drug something.,2024-10-11,2024-10-11,652a1a1f4d8fabcb67861345a2b088ad
075eec73-f6ae-4e05-8337-42205b3f1b74,1062,2078,20240531,7,Fall order hold side among car technology.,2024-05-31,2024-05-31,31e192f44515d8f865f9fa2b546dcff5
025f27f6-1eac-4612-9fd1-b7cc4036de23,40,2704,20250121,2,Help act indeed alone nice cultural debate stay country.,2025-01-21,2025-01-21,35b1b2552857fd1312789e39cde73397
758d4e4d-eeb4-4855-99e5-bc9256dee4da,3213,2076,20250224,9,Its throw air easy.,2025-02-24,2025-02-24,96ce726c0230d4b62a9ab2552870f265
